paper_id,date,content
AUMDR07032017,2017-03-07 00:00:00, PR1351MQT0015 berkuasa terutamanya PDRM menangani ancaman pengganas Daesh PR1351MQT0002 Kota bercadang kajian menyeluruh pemberian subsidi bersasar ianya dinikmati PR1351MQT0005 Laksamana elaun risiko bomba penyelamat dikuatkuasakan PR1351L00284 mengatasi pemerdagangan manusia kesemua pintupintu masuk perancangan bekerjasama agensiagensi perlindungan bantuan mangsa pemerdagangan penyeludupan PR1351L00624 statistik terkini syarikatsyarikat China milikan ekuiti projekprojek Forest City Iskandar Johor Melaka Gateway East Coast Rail Line MalaysiaChina Industrial Park PR1351L00193 pendirian menghadapi tekanan pentadbiran Amerika sejauh ianya dikhuatiri kesan PR1351L00661 subsidi minyak minyak masak keperluan dibayar sekiranya penjimatan subsidi dimansuhkan langkahlangkah dicadangkan membebankan melaksanakan had siling Terangkan impak PR1351L00118 status terkini pengiktirafan pengajian Diploma Vokasional MQA Sekolah Menengah Vokasional SMV dinaiktaraf Kolej Vokasional PR1351L00324 langkahlangkah menangani serangan virusvirus merbahaya kencing tikus Leptospirosis seumpamanya virus misteri maut kejadian Kelantan lalu PR1351L01139 pelaksanaan CEO Faculty Programme Institut Pengajian IPTA impak positif mahasiswa siswi IPTA bercadang memperluaskan Institut Pengajian Swasta IPTS terutamanya dimiliki agensiagensi PR1351L00949 Mara menaja pelajar bidangbidang kritikal perubatan pergigian PR1351L00359 langkahlangkah berkesan mengatasi buruh ladang impak miniestate pekebun PR1351L01284 taraf Damar Laut Manjung Simpang diperuntukkan Nyatakan dimulakan siap PR1351L00809 Rubiah Binti wanita menyertai kembali pekerjaan kerjaya mengelakkan pembaziran guna mahir wanita seterusnya keluarga menghadapi tekanan sara hidup terutama menuju arah maju PR1351L01035 senarai NGO melaksanakan pembayaran GST dikompaun dilepaskan bayaran PR1351L00481 kebelakangan jenayah pintu masuk lapangan KLIA persoalan keyakinan serangan Tamil Naidu Lanka kematian abang tiri Korea Utara KLIA susulan menangani PR1351L00711 prosedur penjualan DBKL tender dilaksanakan penjualan PR1351L00044 kekangan dihadapi teknikal warga dibentuk susulan penemuan suruhanjaya siasatan diraja pendatang izin Sabah melaksanakan pelan dirumuskan suruhanjaya bersedia mendaftarkan Sabah mengeluarkan kad pengenalan selaras rumusan RCI PR1351L01064 SPR mempertimbangkan pemilihan electoral system menggantikan FirstPastThePost FPTP sedia Alternative Voting AV diamalkan Australia Suruhanjaya PR1351L00335 langkahlangkah menangani penularan jangkitan virus rekreasi riadah mengundang kematian terjadi Rekreasi Bukit Merah Air Panas Ulu Legong terpaksa PR1351L00251 tapak sejarah purba upacara kebudayaan diisytiharkan warisan perarakan Wangkang salah warisan PR1351L00227 Fasa Meritam Telahak Buangabai Pengkalan Rejab Sungai Poyan dimulakan tender dianugerahkan kontraktor PR1351L00914 bersekongkol Amerika Arab Saudi menyerang Yaman mengorbankan peroleh penyertaan ketenteraan PR1351L00182 pendirian isuisu sering dibangkitkan perhatian Sabah MA63 berhubungkait Batu Sumpah Sabah siasatan RCI suruhanjaya siasatan diraja pendatang izin Sabah PR1351L01365 peruntukan SJKC setakat peruntukan disampaikan SJKC peruntukan SJKC setakat peruntukan disampaikan SJKC PR1351L00838 sejauh perkembangan arah matlamat intensiti pelepasan gas hijau Green House Gas janjikan COP PR1351L00530 Bayan anggaran ajen pengintip foreign spies beroperasi status terkini pembunuhan Kim Jung Nam ajen Korea Utara PR1351L01104 khususnya menikmati perubatan setaraf perubatan sejauh memantapkan perubatan bagaimanakah pelaksanaan PR1351L01355 status kedaulatan Terumbu Semarang Barat pelan penghasilan petroleum sekitar terumbu PR1351L01239 terperinci status meletak bertingkat Hospital Umum Sarawak HUS projekprojek dimulakan diberikan jaminan Nyatakan sebabsebab ditangguhkan PR1351L00992 terperinci peruntukan diperuntukkan disalurkan Sekolah Jenis Kebangsaan Cina Sekolah Jenis Kebangsaan Tamil PR1351L00488 bekerjasama Imigresen menghubungi Jasmine Loo Ai Swan Casey Tang Keng Chee tersenarai senarai pengamatan tujuan siasatan Kawalan Pertukaran 1953 PR1351L00610 diperuntukkan badan kehakiman membayar peguam mewakili tertuduh melantik peguam keskes melibatkan hukuman mati polisi Common Bar Examinations CBE graduangraduan perundangan mengkaji kebelakangan PR1351L00174 persiapan menghadapi pentadbiran Amerika dipimpin Trump ketiadaan TPPA PR1351L00915 nisbah getah perancangan mengukuhkan komoditi sekiranya perubahan Amerika kesan komoditi PR1351L00830 pembunuhan abang tiri Korea Utara KLIA menyebabkan Korea Utara tegang diplomatik Korea Utara wajar diteruskan PR1351L01054 peruntukan RM50 Bajet disalurkan Sekolah Jenis Kebangsaan Cina setakat PR1351L00306 Irmohizam Bin Ibrahim dilaksanakan penyertaan perlaksanaan Digital sejauh Zon Bebas Digital berupaya PR1351L00049 Padang impak penubuhan koperasi masjid beragama Islam sudut hala tuju perkembangan Perekonomian Ummah kariah masjid terlibat setakat PR1351L01199 bercadang Thailand Vietnam aspek perbelanjaan peruntukan perlindungan KDNK PR1351L01045 pegawaipegawai bekerjasama sekolah khususnya kesedaran dikalangan ibubapa pencapaian Akademik anakanak PR1351L01313 AP kenderaan dikeluarkan kutipan levi diterima setakat PR1351L00585 bercadang mengkaji pengiktirafan Sijil Peperiksaan Bersepadu UEC sememangnya bercanggah kemasukan segelintir Institusi Pengajian Swasta IPTS PR1351L01103 pemohon undi ballot perumahan PR1MA terpaksa melepaskan pembelian gagal perumahan disebabkan amaun kelulusan terlalu PR1351L00513 perintis suntikan mikro organisma Wolbachia telur nyamuk aedes aegypti dikatakan mencegah penularan wabak denggi PR1351L01167 kematian penjara perincian kaum Balamurugan meninggal Balai bantuan perubatan sepatutnya PR1351L01087 juruaudit Parker Randall pengauditan penyata 1MDB pengesahan tarik balik juruaudit Deloitte 1MDB mengemukakan Penyata PR1351L00349 kajian kesesuaian feasibility study membina jambatan Pulau Bruit Daro PR1351L01155 senaraikan pembida dijemput Tabung tender jemaah haji Arab Saudi menyertai PR1351L00221 Paya bekerjasama strategik Pantai Timur ECER proaktif bergabung universiti taraf anakanak asli pantai timur PR1351L01157 senaraikan subkontraktor pembekal Felda Technoplant perincian nama jenis bayaran PR1351L00451 rancangan menaik taraf Hospital Marudi kemudahankemudahan perubatan terkini fiskal bangunan Hospital Marudi PR1351L01156 Mohd Rafizi Bin Ramli KEMAJUAN LUAR pelajar Universiti Institusi Mara IPMa kategori pembiayaan biasiswa MARA biasiswa MARA 
AUMDR07032017,2017-03-07 00:00:00, PR1351L00039 sanction keras BangsaBangsa Bersatu Myanmar penindasan Rohingya PR1351L00345 bangunan bagaimanakah cara audit bangunanbangunan dilakukan PR1351L00898 sejauh keberkesanan subjek Sivik Kewarganegaraan pelajar sekolah gejala sosial pelajar sekolah saban perancangan menerapkan nilainilai murni semangat patriotisme pelajar PR1351L00168 setakat peranan dimainkan memperkasakan tulisan jawi era globalisasi khas diperuntukkan pelajarpelajar berminat belajar tulisan jawi PR1351L01272 perancangan membekalkan air paip terawat Batu Kaya Wong Panjai Wong Pandak Ensawang Changkul Rasau Ng Kumpang Danau Kandis Engkilili PR1351L01260 terkini banduan menghadapi hukuman mati mandatori nyatakan status terkini hasrat memansuhkan Hukuman Mati Mandatori PR1351L01005 didakwa disabit kesalahan PR1351L01257 keperluan pendekatan membina pelabuhan deepsea port menelan perbelanjaan RM billion Pulau Carey PR1351L00670 status terkini insinerator dibina tapak pelupusan sampah Belanga Pecah Kedah PR1351L01158 cara pengiraan formula digunakan menentukan petrol diesel bercadang menetapkan siling minyak beban PR1351L00403 Linda langkahlangkah penguasaan Sains Matematik memacu kemajuan PR1351L00499 pesakit kanser bercadang kemaskini update National Cancer Patient Registry PR1351L00498 bercadang ubat ubat pesakit kanser dikenakan GST bercadang kadarsifarkan ubatubatan senarai Essential Medicines List World Health Organisatition pesakit kanser PR1351L00421 kebajikan Lasah terjamin seekor gajah hidup kurungan langkawi Elephant Advantures PR1351L00765 penagih rawatan pemulihan kategori umur bangsa PR1351L00737 sebabnya inisiatif meminda Syariah sedangkan berbelah bahagi umat Islam penyokong PR1351L00865 menaik taraf Lapangan Sultan Ismail Petra sepertimana diumum RMK PR1351L01201 generasi FELDA dirancang dibina siap dibina kesemuanya siap dibina PR1351L00214 status kakitangan kedutaan konsul PR1351L01340 Batu menambahkan kelapa kelapa akibat Berapakah kelapa dihasilkan terpaksa import PR1351L00770 minyak gas perolehan PETRONAS pendaratan minyak Thailand kesan limpahan PR1351L00720 langkahlangkah mengelakkan kejadian tersingkir jadual skim penilaian pelajar Programme for International Student Assessment PISA sebagaimana PR1351L00086 laluan pensyarah politeknik pencapaian akademik pelajar sejajar hasrat PPPM PT menjadikan politeknik badan berkanun PR1351L00858 caj penukaran hak milik motosikal Sabah mahal RM40 RM3 Semenanjung memang adil Sabah Malah Sarawak dikenakan RM5 pindah milik motosikal PR1351L00871 sejauh kebebasan Peguam mensabitkan pendakwaan rasuah berprofil pensabitan dilakukan Peguam PR1351L00800 peratusan jenayah melibatkan warga Lembah dilakukan mengatasi PR1351L00132 kesediaan kesesuaian melaksanakan turapan getah bagaimanakah Fibre Mastic Asphalt FMA diperkenalkan Perbadanan MTDC PR1351L01105 Merah dilakukan manamana ejen perisik melaksanakan pembunuhan Kim JongNam PR1351L00400 status jenayah langkahlangkah DiRaja mengatasi PR1351L01124 hala Korea Utara terjejas insiden Kim JongNam terbunuh KLIA menghadkan kemasukan warganegara warganegara Korea Utara identiti disangsi masuk PR1351L01303 Alor memupuk kewaspadaan eksploitasi kanakkanak ibubapa anak terutamanya sosial Facebook Whatapps tandatanda diperhatikan PR1351L501389 terperinci keskes usikan meter diterima Berhad TNB kesalahan mengadu layanan adil TNB perhatian Suruhanjaya langsung mengusik meter Pertanyaan PM225 memerintahkan menjaga jalanjalan lorong lorong menuju sentiasa dilalui jangan apaapa halangan menghalang pergi balik jangan apaapa kacaubilau jalanjalan menuju jangan huruhara Bangunan berhampiran bangunan menyampaikan perintah suatu sepertinya dipersembahkan diPertuan bunyinya memohon ampun mempersembahkan suatu ikhlas mengucapkan berbanyakbanyak syukur menjunjung kasih Titah membuka Kebankrapan KaedahKaedah Pemulaan Sivil Memperbaharui Perceraian Setem Perkahwinan kebenaran Peraturan suatu Persendirian Syariah Jenayah berikut Syariah Jenayah dipinda proviso menggantikan perkataan penjara melebihi denda melebihi ribu sebatan melebihi perkataan penjara melebihi denda melebihi ratus ribu sebatan ratus sebagaimana ditadbir selaras tatacara jenayah Syariah PR1351U27002 membahaskan akibat penarikan Amerika TPPA PR1351U27003 daerah begitu mendadak sekali ditokok tambah infrastruktur rancak seiring statusnya daerah rancak membangun Sabah khasnya dewasa sosial sosial ketenteraman sosial topik bualan harian warga ketigatiga topik kedengaran malah kegusaran warga kehadiran kurang disebabkan pewujudan ibu daerah lama tertangguh sosial sosial ketenteraman sosial pentadbiran Ibu Daerah sebahagiannya pentadbiran Ibu Daerah menangani sosial sosial ketenteraman sosial daerah balai dianggotai kurang kelengkapan serba kekurangan terpaksa berhempas pulas menjaga daerah keluasan 30km persegi berkepadatan melebihi ribu berlakunya sesuatu jenayah kecemasan kalanya ketibaan agak lewat jarak kejadian IPD IPD agak jauh tiba Maka menangani ketetapan haruslah segera meluluskan penubuhan IPD lengkap perjawatannya PR1351U27004 Perlembagaan rakyatnya kebebasan beragama Perlembagan menjamin kesamarataan hak warganya menjalani kehidupan harian penaraju gerakan kesederhanaan pimpinan memahat nama persada model penerimaan kepelbagaian agama kaum kakuatannya konsep penerimaan kepelbagaian agama bangsa Gagasan 1Malaysia model mewujudkan keharmonian kemakmuran perpaduan pimpinan berjanji manifesto Barisan PRU ke13 bantuan institusiinstitusi agama berdaftar rumahrumah ibadat contoh Sabah Sarawak khas bajet tahunan maksud bantuan institusiinstitusi agama berdaftar rumahrumah ibadat Sabah Sarawak Maka memenuhi aspirasi Islam khasnya ketetapan khas bajet tahunan institusiinstitusi agama berdaftar ibadat slam PR1351U27005 Asli terdiri Semang Negrito Senoi Proto Malay Asli tinggal Semenanjung penghuni tertua Semenanjung Asli asli Semenanjung disebut Bumiputera namun menikmati keistimewaan diberikan kaum Melayu Bumiputera Sabah Sarawak diiktiraf Bumiputera Perlembagaan Hal Ehwal Asli JHEOA ditubuhkan 1954 pindaan akta Asli 1954 sosio budaya Asli namun disebabkan status Perlembagaan kurang jelas sesuai konsep 1Malaysia diterajui Asli diterima diberikan hak tayanan rata Perlembagaan menjamin kesamarataan hak warganya menjalani kehidupan harian termasuklah kaum Asli Maka menangani kepincangan ketetapan Perlembagaan perkaraperkara dipinda Asli dikategorikan Bumiputera diberikan hak Bumiputera seiringan orangorang Melayu kaum Bumiputera Sabah Sarawak PR1351U27006 setinggan saban makin migrasi terutama sekali tujuan mencari pekerjaan migran berpindah golongan kurang berkemampuan berpendapatan mampu membeli memiliki rumahrumah dibina pemaju PR1MA kebanyakan mampu membayar sewaan RM350 sebulan matlamat mensasarkan sifar setinggan terutama sekali agak sukar dicapai selagi perumahan migran dimaksudkan ditangani tuntas PPR dahulunya sewaan had dilihat alternatif mengatasi setinggan sekali gus sasar menduduki agak selesa malangnya status PPR dipinda status transit pendudukan melebihi PPR alternatif mengatasi setinggan rumahrumah PPR diubah syarat sewaan sewa beli dimaksudkan akhirnya memiliki Maka menangani setinggan kekurangan perumahan golongan kurang mampu ketetapan meminda syarat pendudukan PPR bulanan syarat sewabeli PR1351U27007 Chinese Independent School menjalankan taksiran peperiksaan persekolahan sijil dikenali Unified Examination Certificate UEC dibahagikan Unified Examination Certificate Junior Mtddle UECJML Unified Examination Certificate Vocational UECV Unified Examination Certificate Senior Middle UECSML 
AUMDR07032017,2017-03-07 00:00:00, persijilan UEC diguna pakai persekolahan United Chinese School Committees Association of ianya diperkenalkan sijil UEC diperkenalkan UCSCAM diiktiraf universiti serata United Kingdom Amerika Taiwan Hong Kong China Australia Kanada Singapura malangnya khususnya Lembaga Akreditasi mengiktiraf sijil UEC terutama sekali kemasukkan universiti walau National University of Singapore berkedudukan universiti mengiktiraf sijil UEC ketiadaan pengiktirafan dimaksudkan langsung mengalami kerugian pemegang sijil UEC terpaksa meneruskan aliran keluar kecenderungan lepasan sijil UEC berkerja hal kerugian aliran keluar mahir Maka menangani ketetapan haruslah segera mengiktiraf Sijil Unified Examination Certificate manfaat PR1351U27008 kesan pemanasan perubahan cuaca topik perbualan harian pelusuk ianya fenomena realiti warga tanggungjawab samasama melaksanakan langkahlangkah mitigasi impaknya kehidupan manusia salah penyebab akibat kesan penebangan pokokpokok disebabkan pembukaan ladang sebagainya berkuasa berperanan mitigasi mengatasi bentuk menanam pokokpokok seliaan Maka menangani ketetapan meminta berkuasa segera menanam pokokpokok seliaan samping memperbanyakkan kempen menanam pokok menyemai budaya menanam pokok setempat Asli Sekitar PR1351U27009 Undangan N18 Petagas P173 sekolah menengah Sekolah Menegah SMK Tansau menampung muridmurid keluaran buah sekolah terletak kekurangan sekolah menengah murid Undangan N18 Petagas terpaksa meneruskan persekolahan menengah sekolah menengah Undangan N16 Luyang N17 Aru N19 Kapayan N20 Moyog sekali gus persekolahan pengangkutan menyebabkan ketidakselesaan hidup Sekolah Menengah SMK Petagas dirancang Rancanagn KeSembilan disenaraikan Rancangan KeSebelas RMK11 namun sehinggah tetap permasalahan walau tapak Sekolah Menengah Petagas infrastruktur tersedia RMK9 Maka menangani mendahulukan ketetapan Sekolah Menengah SMK Petagas dibina disiapkan terdekat dirancang terdahulu PR1351U27010 Pangsa Zon melibatkan Pangsa Melaka Johor Ikan Emas Pulau Pinang kegelisahan majoriti penghuni perumahanperumahan terlibat akibat Maka kira suasana memutuskan segala kira perkaraperkara berikut perbincangan penghuni pemilik penyewa wakilwakil blok persatuanpersatuan DBKL mestilah dilibatkan perbincangan Pemilihan pemaju mestilah ditentukan tender penghuni pembeli aspek mestilah keselesaan penghuni kira ciriciri berikut Kepadatan blok Keluasan Kualiti lif binaan Kemampuan membayar yuran penyelenggaraan pemilik PR1351U27011 penuh kebimbangan pergolakan mutakhir mempamerkan suasana ketidakstabilan kritikal memerhatikan penuh kerisauan lagak Amerika Trump Eropah ekoran Brexit Britain Russia Putin mengakibatkan Ukraine diceroboh penembakan pesawat MH17 dekat Republik China menuntut Lautan China Selatan wilayahnya Maka menghadapi krisis memutuskan mempertegaskan menggerakkan sungguhsungguh Asia aman bebas berkecuali ZOPFAN dipersetujui dimeterai Indonesia Filipina Thailand Singapura PR1351U27012 meluluskan ketetapan Audit 1MDB 1Malaysia Development Bhd dibentang dikemukakan perbahasan segera PR1351U27013 meluluskan ketetapan mengisytiharkan harta aset tiaptiap PR1351U27014 meluluskan ketetapan mengesyorkan KBDYMM Dipertuan menubuhkan Suruhanjaya Diraja menyiasat mengemukakan siasatan skandal 1MDB segera PR1351U27015 meluluskan ketetapan selaras titah RajaRaja Melayu dibentang dikaji segera PR1351U27016 meluluskan ketetapan Sijil Peperiksaan Unified Examination Certificate UEC pengiktirifan pengiktirafan penuh PR1351U27017 meluluskan ketetapan sebulat suara selaras semangat Perlembagaan prinsip one man one vote manamana persempadanan pengundinya melebihi perbezaan PR1351U27018 penubuhan entiti persendirian dikenali MyEG menduakan MyEG agensi diperlukan membazirkan sumbersumber mengenakan fi berpatutaan Penubuhan entiti mempersoal integriti amalan korupsi PR1351U27019 menggesa penuh Siasatan Bebas kejadian kebakaran Hospital Sultanah Aminah makluman pengetahuan puncapunca berlakunya kebakaran didesak langkahlangkah mencegah menggelakkan tragedi kebakaran berulang hospital perubatan PR1351U27020 menyokong menetapkan pembelian aset pertahanan melebihi RM100 mesti dibawa dibahas diaudit Audit syarat meneruskan pembelian bertujuan mempertingkatkan integriti keberkesanan pembelian pertahanan diakibatkan pembelian Kapal Selam Scorpene menimbulkan persepsi negatif PR1351U27021 bersetuju peruntukan JPM menyalurkan peruntukan hal ehwal pengangkutan kebajikan Peruntukan dihadkan tahapnya RM34 peruntukan RM35 RM69 anggaran peruntukan melepasi ditetapkan RM492 RM11019 RM1594 PR1351U27022 Bajet RM50 diperuntukkan SJK C disalurkan ditetapkan ketetapan peruntukan bajet diluluskan haruslah disalurkan sewajarnya PR1351U27023 pengusaha teksi persendirian berdaftar swasta menghadapi kesukaran terpaksa menutup salah punca kemasalahan kewujudan Uber GrabCar jauh efisien operasian penggunaan aplikasi telefon pintar Maka menyedari hakikat membahaskan langkahlangkah strategik menyelamatkan pengusaha teksi menghadapi persaingan Uber GrabCar PR1351U27024 menolak janakuasa nuklear memudaratkan sekitar sekiranya kecuaian bencana haruslah ketetapan sekiranya ingin tetap diteruskan harus referendum PR1351U27025 ribu pelajar pelajar menduduki peperiksaan SPM melanjutkan pelajaran gagal Disinilah jurang pemikiran mara pelajaran pendedahan warga anak bangsa berguna gagal terabaraba menanggung risiko terbabas landasan diharapkan dicadangkan pelajar lelaki lepasan SPM dimasukkan kedalam Khas Khidmat National Service dilatih fizikal mental ilmu kewarganegaraan Selebihnya setahun setengah ditempatkan Angkatan Tentera PDRM Sebaik tamat menjalani penempatan ATM PDRM digalakkan meneruskan pelajaran samada jurusan akedemik vokasional kelayakan cara remaja dikurangkan kalaupun diselesaikan kain laksanakan jayanya PR1351U27026 semangat kekitaan berpasukan ditanam jiwa pelajar sekolah pelajar sekolah menengah diwajibkan menyertai beruniform didikan guru guru terlatih bidangbidang tertentu berhubung memperuntukkan guruguru pelajarpelajar memakai uniform sekolah pelajarpelajar merasa bangga membina semangat kekitaan pelajarpelajar guruguru Sehari sekolah seminggu PR1351U27027 ibu bapa mengeluh menghantar anakanak sekolah makin mahal belanja makan harian anakanak sekolah pengusaha kantin kurang kualiti berzat malah membahayakan perisa tiruan pemanis dilarang kempen melibatkan dimulakan dibawa pasti ianya bersih berzat jauh keracunan Pelajar mesti digalakkan air masak putih mengelakkan meminum air bergas air manis merosakkan pelajarpelajar terjamin menghantar anak anak sekolah PR1351U27028 kakitangan ilmu berniaga terlibat sambilan menceburkan diri langsung sayang hilang pencen berhenti Akhirnya fokus tugasan sebenar dicadangkan mengkaji membenarkan kakitangan berhenti pencen dicadangkan seseorang kakitangan awan berkhidmat berhenti pencen samalah Angkatan Tentera dilakukan terlibat pengalaman networking samping dikosongkan diisi lulusan pengajian tetap sesuai PR1351U27029 dewan mempergiatkan menyatupadukan berbilang kaum kelihatan lemah longgar meskipun merdeka berdaulat lalu hidup aman saling memerlukan memahami memudahkan membangunkan merealisasikan Impian PR1351U27030 dewan memulihkan pilihanraya urustadbir cekap akauntabiliti bersih kajian serius melakukan pungutan suara PR1351U27031 mempertimbangkan menghalang mengharamkan penjualan arak murahan cheap liquor murah berleluasa Gegaja pengambilan arak murahan menimbulkan sosial keganasan tangga gengsterisme merosakkan organ dalaman samping kawalan penyeliaan kedaikedai menjual arak diketatkan penjualan arak lokasi minum arak dikaji taman taman permainan kanakkanak minum arak wajib diharamkan wajib mempertimbangkan penubuhan Pemulihan Arak PPA membendung minum arak berleluasa anak muda merentasi sempadan bangsa agama PR1351U27032 mempertimbangkan kematian tahanan DiRaja keluarga mati kebenaran sepenuhnya memperoleh pakar perubatan forensik mewakili keluarga mati bedah siasat dijalankan PR1351U27033 mendesak agama diperkenalkan sekolah pelajar Islam menerapkan nilai nilai murni keagamaan pelajar Islam menangani gegala sosial kian berleluasa akibat kegagalan 
