paper_id,date,last page,content
DR-07032016,2016-03-07 00:00:00,10, Naskhah disemak K N D U N G N Bil TITAH UCAPAN SERI PADUKA BAGINDA Halaman Halaman Ahli-ahli berlangsung Perlembagaan bertitah Ahli-ahli kedua-dua bersesama tempohkan waktu menyambut keberangkatan tiba Keberangkatan tiba bersemayam Peterana mempersembahkan Ahli-Ahli Ahli-Ahli sekalian memanjatkan kesyukuran hadrat limpah kurnia bersama-sama Ahli-Ahli bersyukur hadrat kehendak dianugerahkan berterusan menaungi memayungi tercinta ungkapan dizahirkan peri eloknya lakaran potret keamanan dicapai pertiwi bertuah takhta pencapaian era berbeza kesinambungan pentadbiran dikekalkan merealisasi matlamat maju berpendapatan bersandarkan pencapaian semata-mata mengutamakan kesejahteraan memanjatkan kesyukuran kurniaan sayang-Nya melindungi bencana mara bahaya Sama-samalah berdoa semoga berkekalan sedar bencana banjir hampir fenomena biasa khususnya perubahan suhu iklim segala persediaan bencana digembleng dipertingkatkan terutamanya menghadapi bencana banjir Penubuhan Agensi Bencana NADMA diharap mengukuhkan kesiapsiagaan menghadapi bencana pendekatan kreatif inovatif sains memantau meramal menangani risiko bencana banjir Ancaman menggugat kesejahteraan nyata Perkembangan ancaman militan anasir keganasan mula menular perhatian serius menjerumus kancah ketidakstabilan Sehubungan menyokong proaktif pewujudan undang-undang mempertingkatkan aset-aset mengekang fahaman ekstrem penularan ideologi militan komited infrastruktur aset keperluan sempadan memperkasakan kawalan agensi perbatasan penubuhan Agensi Sempadan Penyertaan penempatan Pintas Mesej memerangi keganasan jenayah rentas sempadan mempertingkatkan membanteras pemerdagangan pengiktirafan memperbaiki Tahunan Amerika pemerdagangan mengucapkan tahniah Mamanda pencapaian-pencapaian lalu Kejayaan Kemuncak ASEAN merealisasikan Pembentukan Komuniti ASEAN membanggakan Sidang-sidang kemuncak menghimpunkan pemimpin-pemimpin forum menyerlahkan peranan persada menduduki Kerusi Lembaga UNESCO mengekalkan kerusi Maritim berturut-turut daya saing menduduki ke-18 buah Daya Saing 2015-2016 mencerminkan keyakinan komuniti Ahli-Ahli ketidaktentuan khususnya kejatuhan minyak kesan nilai Walau asas-asas fiskal cekap disokong pelaksanaan Cukai Barang GST mulai mapan berkembang berkembang perhatian pengukuhan mengukuhkan daya tahan Kebergantungan minyak gas dikurangkan dilaksanakan transformasi fiskal berhemat mempelbagaikan menyeru swasta memainkan peranan menjana merancakkan Penyediaan Mudahcara RM20 diharap pelaksanaan swasta berskala berimpak defisit sasaran fiskal berimbang dilaksanakan Penurunan defisit mengukuhkan fiskal mempengaruhi penarafan kredit Sekiranya penarafan kredit langsung berkurangan seterusnya menjejaskan menyebabkan pembiayaan perumahan dielakkan melaksanakan pengubahsuaian Bajet menetapkan matlamat memelihara kesejahteraan tepat Sehubungan menyeru agensi- agensi swasta NGO bersama-sama menggembleng fikiran melaksanakan pengubahsuaian penstrukturan diperkenalkan Marilah berdoa berusaha tahun-tahun mendatang bertambah kemakmuran hemat kompetitif saling berkait memperluaskan akses berterusan menyertai Perkongsian Trans- Pasifik TPPA luas komuniti anggaran Keluaran Kasar USD27 trilion sentiasa mempertahankan agenda Bumiputera rundingan TPPA mengucapkan tahniah membahas meluluskan menyertai TPPA khas lalu perunding agensi bekerja keras merundingkan terma-terma sebaik pelaksanaan Rancangan Kesebelas bertemakan Berpaksikan menyeru berusaha bersungguh-sungguh menjayakan agenda dirancang dilaksanakan sepenuhnya merealisasikan matlamat maju inklusif mampan selaras Wawasan mengucapkan tahniah kejayaan pelaksanaan hampir 12000 Rancangan Kesepuluh kesejahteraan Ahli-Ahli teras Rancangan Kesebelas melibatkan pengurangan intensiti karbon Pendekatan agresif melaksanakan inisiatif penjanaan kecekapan bandar-bandar bercirikan karbon perluasan pengangkutan Aliran Transit Massa penggunaan kenderaan elektrik dikurniakan keindahan unik kepelbagaian budaya diiktiraf destinasi pelancong Islam merancakkan industri pelancongan domestik promosi pakej-pakej pelancongan kreatif berasaskan kebudayaan warisan yakin industri pelancongan berkembang pesat sekiranya dipelihara kebudayaan dikekalkan kebersihan persekitaran dipertingkatkan Ahli-Ahli prihatin lapisan khususnya berpendapatan terendah pertengahan golongan ditingkatkan gaji minimum perluasan jaringan perlindungan sosial pembiayaan mikro kemahiran perluasan eRezeki eUsahawan Menyedari komunikasi berdaya harap keperluan internet jalur lebar berkelajuan dimiliki menyasarkan sekurang-kurangnya berpenduduk akses internet Demi kesejahteraan golongan sentiasa berusaha melaksana inisiatif dijadikan penanda aras menentukan gaji sesuai kelayakan kemahiran produktiviti kesejahteraan golongan dipertingkatkan menjalani kehidupan selesa Golongan memerlukan kanak-kanak warga emas kurang upaya dilupakan kebajikan sosial meneruskan pemberian elaun OKU bantuan kanak-kanak miskin perlindungan golongan memerlukan bantuan perubatan pesara hal menyeru swasta badan menyumbang kemudahan-kemudahan golongan memerlukan mengalu-alukan penubuhan Khas Menangani Sara Hidup senarai kenaan GST sifar membuktikan bersedia mendengar pandangan melindungi menyeru tegas pihak- mengeksploitasi berlebihan harus bijak berbelanja membezakan keperluan kehendak utamakan milik mencukupi berkualiti memerlukan dipergiatkan Setakat sasaran milik siap pelaksanaan Inisiatif-inisiatif Skim Sabah Sarawak Asli generasi FELDA FELCRA RISDA PPA1M PR1MA diteruskan Skim Pembiayaan Deposit diperkenalkan Bajet diharap berpendapatan sederhana membeli Ahli-Ahli potensi agromakanan diperkukuh keupayaan pertanian berasaskan menyeru industri agromakanan ditransformasi moden dinamik kompetitif menghasilkan daya tarikan usaha-usaha digerakkan golongan belia menceburi daya saing diperkukuhkan insentif tanam pekebun-pekebun rantaian nilai aktiviti-aktiviti penyelidikan pengkomersialan komited kualiti hidup Asli Bumiputera minoriti Sabah Sarawak transformasi bertemakan Membandarkan berpaksikan keperluan kehendak dilaksanakan menyokong penuh usaha-usaha mempelbagaikan penerokaan subsektor industri hiliran penguasaan rantaian nilai industri pekebun terbiar Lebuh Pan Borneo dinantikan Sarawak Sabah memacu kedua-dua kesejahteraan dilupakan meringankan beban perumahan milik pengangkutan cekap bersepadu menaik taraf pengangkutan rel buah lapangan dilaksanakan Perubahan profil demografi gaya hidup penjagaan Transformasi akses penjagaan berkualiti diperkukuhkan Komuniti Sihat Perkasa menyeru kembali prinsip mencegah mengubati amalkan gaya hidup sihat Budaya bersukan ternyata kesejahteraan produktiviti momentum Sukan kemuncak gerakan massa Fit diteruskan menyokong pelaksanaan Pelan Sukan Jangka Podium melahirkan atlet profesional bertaraf penyertaan kontinjen temasya Sukan Olimpik Brazil melakar sejarah memenangi pingat emas Golongan wanita berperanan penyertaan wanita pekerjaan dipertingkatkan mewujudkan persekitaran kondusif Ruang disediakan menyertai menceburi keusahawanan potensi kerjaya memegang tertinggi pembuat organisasi Generasi belia aset memacu hala tuju pelaksanaan kepimpinan bakat kemahiran kesukarelawan dipertingkatkan terkandung Belia Pelaksanaan Pelan PPPM melangkah gelombang menyeru usaha-usaha diteruskan kualiti setanding Fakulti dilaksanakan PPPM melahirkan insan holistik diharap kebolehpasaran graduan kecenderungan pelajar dikekalkan memilih Sains Kejuruteraan Matematik STEM insan terencat mengukuhkan penyelidikan inovasi berimpak memacu arah maju berpendapatan menjadikan sains inovasi STI selaras Pelan Induk STI digubal Ahli-Ahli mengingatkan jelata sentiasa memelihara keharmonian kerukunan hidup bermasyarakat Sehubungan cubaan segelintir memainkan sentimen perkauman menyalahgunakan sosial menyebarkan kandungan berbaur hasutan fitnah fahaman ekstremis dikekang ditangani segera agensi-agensi Kelewatan bertindak berhubung isu-isu melibatkan perpaduan kaum menyebabkan konflik perbalahan menyokong penuh segala inisiatif mendaulatkan Islam agama agama-agama diamalkan bebas damai langkah-langkah arah memperkukuhkan institusi agama kecekapan pelaksanaan undang-undang pentadbiran agama Islam pemerkasaan syariah disegerakan Isu-isu keagamaan dirujuk berautoriti agama wajar tafsiran individu berkelompok mencetuskan kecelaruan ketegangan konflik Ahli-Ahli mengalu-alukan transformasi diusulkan dibentangkan Ahli-Ahli menjadikan institusi berkesan melaksanakan fungsinya cabang pentadbiran Usaha-usaha mentransformasikan arah berpaksikan produktiviti kecekapan dilaksanakan Setakat ditawarkan 
DR-07032016,2016-03-07 00:00:00,12, talian kecekapan demi menyeru anggota-anggota sentiasa melindungi kerahsiaan mematuhi undang-undang berkuat menjamin kestabilan Jalinan pendekatan Strategi Lautan Biru Kebangsaan pelaksanaan misalnya Jiwa Murni rondaan penguatkuasaan perkongsian aset agensi berkesan kecekapan impak menjimatkan dipertingkatkan menjayakan perancangan integriti tadbir dipertingkatkan yakin menangani persepsi negatif rasuah penyelewengan guna samping mengamalkan nilai-nilai murni budaya hidup berintegriti Ahli-Ahli titah menyeru Ahli-Ahli keseluruhannya bersatu sayangilah sentiasa menumpahkan taat setia berbelah bahagi mempertahan melindunginya berhentilah berpolitik sempit berlarutan melelahkan Berikanlah teladan saling bergandingan melahirkan buah fikiran bermanfaat demi kesejahteraan kemakmuran berterusan demokrasi berperlembagaan berlainan pandangan Raikanlah ruang namun saling menjatuhkan bermusuhan fitnah-memfitnah akhirnya menjerumus kehancuran Elakkan memburuk-burukkan menghargai sumbangan terutama pengorbanan Angkatan Tentera agensi- agensi pertahanan penguat terutama jelata menjamin kedaulatan keamanan hasilnya nikmati menumpahkan taat setia menyumbang kemakmuran bertuah titah berdoa hadrat semoga tercinta maju makmur rakyatnya taufik hidayah bersatu padu sentiasa hidup aman sentosa lindungan-Nya SekianWabillahi Taufik Walhidayah Ahli-ahli Doa selamat dibaca berangkat meninggalkan 
DR-07032017,2017-03-07 00:00:00,10, Naskhah disemak Bil K N D U N G N - - Memperkenankan Akta-akta - Perutusan JAWAPAN-JAWAPAN BAGI PERTANYAAN-PERTANYAAN Jalan-jalan Masuk Menjunjung - Simpang Rengam Halaman Halaman Halaman Halaman Halaman Halaman Halaman Ahli-ahli sukacitanya memaklumkan limpah kurnia berkenan menyampaikan salinan seterusnya mengarahkan salinan dibentangkan meja seterusnya dicetak Penyata Rasmi Ahli-ahli suka memberitahu limpah kurnia memperkenankan sebelas Akta-akta diluluskan lalu berikut Infrastruktur Asia Perancangan Desa Perbekalan Kesalahan Berhubungan Anugerah Lambang Nama Mencegah Penggunaan WajarPindaan2017 Pentadbiran Undang-undang Islam PersekutuanPindaan Pendaftaran Kelahiran Kematian Berkuasa Ordinan Perkapalan Saudagar perutusan menyatakan persetujuan undang-undang diluluskan lalu membacakan Perutusan meluluskan undang-undang berikut Undang-undang Perbekalan Undang-undang Undang-undang Infrastruktur Asia Undang-undang Perancangan Desa Undang-undang Pentadbiran Undang-undang Islam Wilayah- wilayah Undang-undang Pendaftaran Kelahiran Kematian Undang-undang Ordinan Peguam Bela Sabah Undang-undang Kesalahan Berhubungan Anugerah Undang-undang Lambang Nama Mencegah Penggunaan WajarPindaan Undang-undang Berkuasa Undang-undang JAWAPAN-JAWAPAN BAGI PERTANYAAN-PERTANYAAN ucapkan setinggi-tinggi penghargaan tahniah cekap mengatasi Daesh Raja Salman lawatan rasmi cubaan sabotaj syabas tahniah anak-anak buah seluruhnya khususnya Counter-Terrorism jabatan-jabatan Counter-Terrorism melaksanakannya menyatakan berkuasa terutamanya PDRM menangani ancaman pengganas Daesh relevan situasi prihatin dilakukan PDRM bekerjasama agensi perisikan Interpol perolehi perolehi Perkongsian lakukan tindakan-tindakan susulan penangkapan pencegahan sebagainya senarai syak suspect list Aseanapol senarai kemukakan Imigresen ditahan memasuki senarai syak perolehi keberadaan samping mengusahakan APSS Advance Passangers Screening System menifes penumpang- penumpang perolehi kapal bertolak bersiap siaga menubuhkan counter messaging center pemantauan transaksi check dilakukan social accounts perolehi sumber-sumber perisikan menubuhkan Sekretariat Diradikalisasi anti keganasan Bali diberikan kepercayaan mengetuai Sekretariat Diradikalisasi sumbangan kejayaan melakukan pemulihan pengganas- pengganas 1948 menghadapi pengganas komunis pencapaian kejayaan harus dikongsi cuma tambahan yakin pemulihan diradikalisasi dijalankan pengganas ideologi ekstrem sedar anak-anak muda khususnya para-para penuntut menuntut terpedaya terpengaruh ideologi-ideologi dibawa Daesh yakin melaksanakannya melakukan pencegahan melakukan NGO Persatuan-persatuan Pelajar malah universiti pembangkang melakukan pembanterasan menubuhkan kempen kesedaran samping dapati National Blue Ocean Strategy Strategi Lautan Biru agensi penguatkuasaan tentera agensi penguatkuasaan menentukan elemen-elemen sihat mempengaruhi nampak dengar suara Berhomat saat saat sedia Pantai Timur Sabah terutama ESSCOM Pulau Sebatik sampai ancaman-ancaman pengganas memang tindakan-tindakan sempadan sampai jenayah kemudian berkesan mengatasi Pantai Timur Sabah melakukan kaedah pencegahan terutamanya pertemuan Thai ditandatangani persetujuan agensi penguatkuasaan dilakukan Filipina Indonesia merekodkan mulia rombongan disertai mengenali Filipina keberkesanan operasi-operasi dilakukan berbincang Parlimennya melakukan menentang saudara mara pihak-pihak cuba mengganggu gugat menyebutkan otai dipanggil Asal terlibat faham dilakukan ESSCOM ESSZONE pencegahan dilakukan melakukan sesuatu mengenakan perintah berkurung tertentu keberkesanan Kota menyatakan bercadang kajian menyeluruh pemberian subsidi bersasar ianya dinikmati melaksanakan rasionalisasi subsidi berperingkat menstruktur kaedah pemberian subsidi pukal pemberian subsidi bersasar prinsip pemberian subsidi tetap diteruskan disasarkan berpendapatan benar-benar memerlukan pelaksanaan rasionalisasi subsidi kecekapan perbelanjaan pengagihan penggunaan cekap Ketirisan perbelanjaan dikurangkan khususnya pengurangan kegiatan penyeludupan penyelewengan penggunaan keperluan bersubsidi gula beras tepung minyak masak warga penjimatan diperolehi pelaksanaan rasionalisasi subsidi bersasar disalurkan berpendapatan bentuk bantuan BR1M bantuan persekolahan subsidi-subsidi digunakan pembiayaan manfaat peruntukan pengangkutan tambahan sejauh subsidi diberikan tersasar Makna ketirisan dapati subsidi diseludupkan setakat setelah dilaksanakan melibatkan ketirisan menyebabkan subsidi sepatutnya dinikmati tersasar akibat penyeludupan penjelasan Setakat pemberian pre condition kena BR1M BR1M dikenakan BR1M kena RM4 RM4 vey spesific targetted bantuan persekolahan RM100 ibu bapa RM3 RM100 pengetahuan meneruskan subsidi-subsidi subsidi padi teruskan targetted group farmers padi Kemudian subsidi contohnya setakat tol RM593 subsidi naikkan certain tol dibayar targeted subsidy minyak pengapungan minyak saving masuk akaun disatukan diagihkan subsidi sebutkan Kota tambahan bercadang MyKad kupon khas menyampaikan subsidi bersasar MyKad BR1M RM1200 masuk kad kawasan- guna kad ambil kad hypermarket senang kawasan-kawasan Sabah Sarawak outlet ambil barang-barang cash akaun memudahkan berbelanja duit inilah pertimbangkan outlet membeli barang kawasan-kawasan pedalaman berbeza Sabah Sarawak sebagainya merasakan memasukkan duit cash akaun individu berkelayakan subsidi berbelanja barang-barang keperluan perlukan setakat menyatakan elaun risiko bomba penyelamat dikuatkuasakan ucapkan prihatin kebajikan bomba penyelamat makluman bomba Penyelamat mengemukakan permohonan elaun risiko elaun khas skim bomba agensi pertimbangan Elaun khas bomba pangkat sebagaimana elaun khas diluluskan agensi-agensi penguat sesuai risiko tugas dihadapi Walau Bomba Penyelamat sentiasa kebajikan bomba terjamin selaras risiko tugas tanggungjawab antaranya bomba layak pampasan Skim Ex-Gratia Bencana persekutuan termaktub 1PP WP6 meluluskan Skim Insurans Takaful Berkelompok khusus bomba menjaga kebajikan bomba waris keluarga kematian ketiadaan kecacatan bertugas aspek bertugas bomba diarahkan mematuhi berpandukan mewujudkan budaya kondusif selamat melaksanakan kebombaan bomba dibekalkan peralatan pakaian perlindungan PPE helmet jaket api glove hood kasut api bertugas samping Bomba Penyelamat Latihan Akademi Bomba melaksanakan kursus latihan pengukuhan pegawai-pegawai bomba kompetensi kemahiran individu menghadapi kebakaran kecemasan efektif selamat 
