paper_id,date,last page,content
DR-07032017,2017-03-07 00:00:00,120, data Perangkaan dikeluarkan Tentunya perbelanjaan penggunaan berikutnya pasti kesan penurunan guna household disposable income purata bulanan perbelanjaan sekurang-kurangnya RM3578 Bayangkanlah kesusahan hidup kakitangan gaji minimum RM1000 sebulan Semenanjung RM900 Sabah Sarawak syorkan sekurang-kurangnya RM1500 gaji minimum seterusnya menyentuh isu-isu penjelasan sedikit silakan Bayan berterima bangkitkan penjelasan ulasan Baru-baru terjumpa muda berjumpa mengalami serius graduan bekerja sekejap sambung belajar MBA semester terakhir tinggal graduate MBA cari interview Khazanah Khazanah tawarkan MBA tawarkan RM1800 sebulan ambil diulang-ulang complained survive RM1800 ibu kota langsung pelajaran gaji RM1800 teruklah bangkitkan barang memang survive hakikat muda Melayu pekerjaan ibu kota nampak disconnect bagus nampak kaya Intra- community inequality inequality kaya kaya miskin stuck teruk Imagine lalu graduate gaji RM1800 years later graduan MBA RM1800 this disconnect people s economy KDNK nampak inequality ketara serius Nampaknya is living in the bubble sengsaranya hidup ulasan Memanglah teguran- teguran dibuatkan inilah pembangkang asyik-asyik bangkang memburukkan imej kan adakan suara wakil Dengarlah rintihan hendakkan penjelasan sedikit Kota tertarik diberitakan mencadangkan RM1500 gaji minimum disebut manifesto Pakatan sahabat sebelah cakap fasal RM1800 tanya living in the bubble tambah RM1500 minima tambahan rationalize will cost between RM30 billion RM40 billion maybe up to RM50 billion Pakatan merealisasikan gaji minima Inilah sebenarnya pandangan bubble realistik pandangan bersekali fokuskan purata maksudkan RM1500 the minimum diachieve pekerja-pekerja Currently katakanlah RM1000 bezanya RM500 RM500 itulah diberikan bentuk subsidi yakin semuanya RM1000 RM1300 RM1400 kurang jangkaan berpendapatan below than RM1500 bersetuju rangkuman gaji minimum menyeluruh RM1500 harus diingat B40 M40 sedikit majoritinya RM1500 setuju sara hidup waktu mendesak menyuntik Singapura pandangan Memanglah meringankan bebanan syorkan Undi dululah tengoklah you you are not doing it sambung Kota Sedikit payah cakap tahu-tahu cakap tu cara-caranya pakai punya pendapat dulu - MTUC hargai pandangan Penjelasan teruskan ni Duduk Takkan tanya kot ni tanya Wow Hendak bagikah pasti bergembira kempen pembangkang pembangkang terutamanya pembangkang million terlampau sebabnya bersamaan perpuluhan something pembangkang berkempen dikurangkan separuh bercakap tipu Dakyah sebar fitnah Fitnah kempen kempen Tarik Tarik tarik Pembangkang dakwaan Dakwaan berasas Dakyah memperlekehkan perlekehkan bertanya mencelah bertanya sahabat bertanya sahabat -orang janganlah melakukan penyibukkan biasa kempen pembangkang Membetulkan fakta terlampau Fakta mulia lagikah Dengar habis dahulu kempen pembangkang million terlampau kurangkan separuh kempen Siapa kempen habis Sabar dakwaan berasas fakta disebut - bercakap pembangkang bercakap million terlampau bersamaan tiap-tiap pembangkang berhasrat memerintah sahabat kasihi menyebut tunggu memerintah pembangkang memerintah pastinya kurangkan bercanggah bersekali Pencelahan teruja mendengarkan komentar nampaknya prihatin perbahasan Pembangkang bertanya mungkinkah diutarakan sebenarnya timbul dikeluarkan Government Transformation Programme dinyatakan pelan pelan GTP ingat adakan tertera perancangan Government Transformation Programme is to downsize downsize government Maksudnya kakitangan sebenarnya dikelirukan hormati ruang Hendak pendapat sedemikian cara maklumkan rancangan GTP sebenarnya kakitangan komentar tepat tepat Permatang pauh ruang tepat beritahu duduk duduk duduk You duduk dulu You duduk floor floor Pembangkang floor duduk You-lah duduk Duduk Duduk Duduk You duduk Duduk Kamu duduk dulu floor floor Gangguan rakaman mencelah Duduk duduk duduk mengingkari arahan halau keluar siapa suruh duduk suruh duduk apalah duduk duduk duduklah Okeylah payah suruh duduk kamu Duduklah Duduk suruh duduk duduk suruh duduk ruang dibagi Diam akur kebijaksanaan rekod cuma menjawab tuduhan berasas dakwaan kononnya kempen kakitangan kempen kakitangan faktanya menimbulkan kebimbangan Penjelasan beban terlalu tanya patut tanya punya floor tanya faham Cara bertanya benar benarlah benar tolong ajukan Segala tuduhan benar kena address Permatang inginkan penjelasan floor duduk penjelasan mencelah mencelah you mencelah memang harus ajukan Permatang memang Yalah celah Tengok tengok celah tengok tengok tengok tengok tengok buang tengok masalahkah handsome tengok sahajalah Duduklah cuma katakan mulia kempen didakwa Cuma melahirkan rasa kebimbangan civil service bloated civil service Civil service terlalu kebimbangan pengetahuan kebimbangan diutarakan adik Nazir Razak melahirkan kebimbangan kebimbangan beban terlalu menangani civil service di-downsize kan tuduhan dakwaan Menyampuk unsur-unsur fitnah kakitangan menakut-nakutkan pengundi- pengundi Melayu dakyah konco- konconya Penjelasan memaklumkan Hendak 
DR-07032017,2017-03-07 00:00:00,130, tetap mempertahan pembuangan dicadangkan floor mengingatkan kembali lalu Perbendaharaan Sheriff Kassim lupa lalu pandangan saiz akhirnya menyusahkan pandangan keluar harap dilihat sudut non partisan demi kebaikan mencelah ajukan sedikit persembahan persembahan Ketawa mempertahankan kakitangan Setujukah sara hidup minyak GST sebagainya cara membela kakitangan membuang penasihat- penasihat bergaji diberikan kakitangan kakitangan bergaji diberikan gaji kakitangan pangkat Jusa C Menteri-menteri terbalik Jusa C gaji wajib confirm setahun sedangkan bawah-bawah Setujukah potong gaji dulu kakitangan Ketawa isytiharkan pandanganlah Potong gaji no problem cerita potong gaji no problem Ahli-ahli setuju potong Setuju floor floor potong floor Ambil potong percent percent sahajalah diri percent cerita pembangkang potong percent Setuju potong percent potong Setuju Betul-betul pelakon komedi level tambah sedikit tanya baca surat khabar lalu menimbulkan kebimbangan civil service terlalu Ketawa tanya baca setuju pandangan champion civil service belakang Hendak Sikit belakang Silakan silakan Sebaris disebut disebut belanjawan lalu saiz kakitangan terlalu Disebut cerita dongeng ketawa Yalah memanglah pandangan menanggung membengkak namun pandangan ambil penjawat- penjawat khidmat khidmat pandangan KSP Perbendaharaan Sheriff spelling S H E R I F F ingat pandangan lihatlah nakkan kebaikan teruskan Seterusnya menyentuh fiskal sedia sikit menguncup Keadilan Amanah rizab RM426 USD95 rizab RM425 USD134 penyusutan sikit result pengecilan penyusutan pengecilan result USD39 Hutang hutang kena bayar Hutang persekutuan didapati hutang persekutuan RM655 KDNK Keluaran Kasar RM407 KDNK hutang persekutuan bertambah hutang Siapa membayar cucu tinggalkan hutang dibayar Pertukaran penyusutan kritikal Amerika menjunam pertukaran USD1 bersamaan RM3 6925 lalu USD1 bersamaan RM4 4430 Kota sikit pembetulan penjelasan sikit Penurunan Amerika Kota menguncup perbetulkan sikit betulkan fakta sikit mula start gaduh-gaduh pasal point point menguncup kurang berkembang data-data sebutkan bermasalah kritikal problem digembar-gemburkan Kota cakap Kota Fakta baca fakta fakta menguncup cuma perkembangan kurang sedikit membuatkan misleading mengelirukan betulkan bincanglah payah bincang tegak payah bincang cakap punya bincanglah payahlah mencelah you bincanglah you bercakaplah laluan betulkan sedikit laluan bermakna payah beza You laluan betulkan sikit menguncup menguncup cuma kurang berkembang beza floor sampaikan fakta bertanya menimbulkan dialog menanya penjelasan data-data sebutkan bermasalah kritikal sering digembar-gemburkan Memburukkan persepsi rasuah dikeluarkan Transparency International tangga Persepsi rasuah bertambah buruk persepsi rasuah tangga tangga persepsi rasuah bagus is bad for us Imej bergelumang rasuah Financial Integrity mengeluarkan bertajuk Elicit Financial Flows from Developing Countries to menyebut ke-5 kumulatif Elicit Financial Up Flows haram duit haram USD418 Dibanding KDNK elicit financial up flows haram keluar KDNK tertinggi merasa bangga Rusia nombor kalah Rusia ikuti Mexico India China 7peratus tambah baru-baru baru-baru Transparency International mengeluarkan kajian barometer rasuah Asia Pacific didapati bersetuju gejala rasuah kian parah merasakan budaya merasakan cara hidup bermaruah biarkan begini tanya sikit menyatakan rasuah elicit money sebagainya Setuju gejala rasuah teruk memang sukarlah mana-mana rasuah RM1500 setuju Memang mustahil rasuah rasa menyatakan Transparency International sebagainya takut dituduh Setuju semuanya setuju ingat hati kecilnya RM1500 membebankan hendakkan kebaikan not bad rasa Bolehlah puratanya membimbangkan senyum-senyum fakta membimbangkan senyum-senyum faktanya membimbangkan Tambahan siri-siri tangkapan rasuah guna disiasat sambung Ahli-ahli I Ahli-Ahli Ahli-Ahli sekalian segala pujian kesyukuran hadrat limpah kurnia bersamasama Selawat junjungan pembawa rahmat sekalian keluarga sahabat-sahabat Terlebih dahulu merakamkan setinggi-tinggi penghargaan bersemayam menaungi jelata penuh adil saksama bijaksana bersyukur kehendak dilantik bertuah berikrar meneruskan kesinambungan pemerintahan adil saksama mengutamakan kesejahteraan kemakmuran berlandaskan prinsip Raja Berperlembagaan mengucapkan tahniah Mamanda barisan Jemaah Anggota-anggota Pentadbiran penjawat sekalian jelata penat lelah membangunkan Marilah saling bekerjasama kejayaan-kejayaan merakamkan tahniah kejayaan PDRM jenayah membasmi fahaman radikal ajaran-ajaran sesat ideologi militan bercanggah pegangan Sunnah Wal Jamaah dilupakan Angkatan Tentera memainkan peranan menjaga menyedari pengorbanan terhingga demi tercinta memperkukuhkan kedua-dua diizinkan berhasrat perolehan kelengkapan kenderaan menjaga kebajikan kuarters memperluaskan faedah-faedah tertentu cedera keluarga veteran meninggal sebagainya mengalu-alukan menempatkan aset fasiliti pangkalan helikopter sea basing perairan pantai timur Sabah persefahaman dicapai Filipina berhubung kawalan Laut Sulu mengukuhkan hala kedua-dua terutama Ahli-Ahli komited meneruskan konsolidasi fiskal sasaran bajet berimbang berusaha gigih langkah-langkah konkrit saiz RM1 trilion RM2 trilion samping jangka berusaha menjadikan buah menyeru berganding bahu menghadapi cabaran-cabaran produktiviti arah mampan 
DR-07032017,2017-03-07 00:00:00,135, produktiviti berterusan berasaskan kreativiti inovasi pemangkin merealisasikan menjadikan berdaya saing sedar penyusutan nilai kesan Namun penyusutan disebabkan faktor luaran dalaman percaya bertindak komitmen sepenuhnya menyelesaikan secepat Ahli-Ahli langkah-langkah beban terutamanya berpendapatan terendah B40 pertengahan M40 kedua-dua terdedah beban mengalu-alukan insentif menjana tambahan meneruskan pemberian subsidi bersasar mempelbagaikan pelaksanaan Bantuan BR1M bantuan bantuan pemandu teksi memiliki permit pelepasan cukai gaya hidup meringankan beban sara hidup kedua-dua terbabit mengharungi kehidupan seharian meminda Kebankrapan golongan bankrap bangkit kembali memulakan kehidupan menyumbang taraf hidup mempelbagaikan insentif bantuan memperoleh gus menangani sara hidup samping penguatkuasaan dipergiatkan bertanggungjawab kesejahteraan terpelihara cabaran kehidupan pemilikan keperluannya sentiasa seiring pertambahan prihatin sentiasa berusaha milik golongan berpendapatan sederhana memiliki kediaman Lain-lain insentif diperkenalkan Penjawat sewa beli RTO MyDeposit MyHome Bina FELCRA RISDA Generasi FELDA sebagainya Setakat sasaran milik pelaksanaan siap bercadang membina 10000 muda kelompok M40 dipanggil Milik golongan belia kurang 5000 dibina milik Kuala Lumpur sukacita penekanan prasarana pengangkutan terutamanya berasaskan rel Keretapi Berkelajuan High Speed Rail Transit Aliran Massa Mass Rapid Transit Laluan Rel Pantai Timur sambungan Transit Aliran Ringan Light Rail Transit - LRT mobiliti Sesungguhnya menunggu menikmati pengangkutan efisien berkualiti tambang berpatutan maju mengucapkan tahniah terlaksananya ikonik transit aliran massa MRT Buloh-Kajang Fasa mula beroperasi disusuli Fasa mengalu-alukan Laluan Rel Pantai Timur menghubungkan pantai timur pantai barat Semenanjung Lebuhraya Pan Borneo pemangkin Sabah Sarawak Pelaksanaan jaringan pengangkutan merangsang kegiatan meletakkan setanding maju Ahli-Ahli Kebajikan Asli peribumi Sabah Sarawak sentiasa perhatian melaksanakan infrastruktur sosial menaik taraf bangunan sekolah daif terutamanya Sabah Sarawak diperkukuhkan Transformasi dirangka selaras keperluan mengucapkan syabas Mamanda inisiatif tertentu mendorong getah minyak sedar menimbulkan publisiti negatif mengaitkan isu-isu menjejaskan Sehubungan promosi kempen penerangan menangkis segala tohmahan menyeru jaminan bekalan mencukupi berkualiti munasabah keperluan dipenuhi selaras aspirasi Program-program galakan pendedahan potensi pertanian moden berinovatif ditingkatkan memenuhi pertanian menjanjikan lumayan diusahakan kreatif terkini menjadikan self-sufficient agrikultur sumbangan wanita mengalu- alukan penglibatan golongan diteruskan Rancangan Kesebelas menetapkan sasaran penyertaan wanita Menyedari pentingnya keseimbangan kesejahteraan keluarga menggubal Pelan Keluarga panduan sosioekonomi institusi kekeluargaan berganding bahu memelihara kebajikan golongan terjejas kanak-kanak warga emas ibu tunggal miskin kurang upaya dilindungi melindungi golongan kanak-kanak penjenayah seksual mengeksploitasi membentangkan undang-undang jenayah seksual kanak-kanak menangani komprehensif Kerosakan sekitar menjejaskan kehidupan dipulihkan sepenuhnya melibatkan menggesa menghargai melindungi memusnahkan keseimbangan ekologi Contohnya undang-undang dikuatkuasakan sepenuhnya demi keyakinan serius menjaga memulihara pengekalan sekitar menyeru mengamalkan gaya hidup cekap arah matlamat karbon prihatin membuang sampah merata-rata tandas-tandas keutamaan kebersihannya prihatin agak membimbangkan kes-kes penyakit berjangkit saringan risiko penyakit berjangkit khidmat nasihat penjagaan disediakan klinik Klinik Berbanggalah memiliki prasarana diiktiraf menyeru mengamalkan gaya hidup sihat pemakanan seimbang diri Ahli-Ahli Kepelbagaian budaya warisan keunikan daya tarikan pelancongan penyumbang menyeru dipertingkatkan mempelbagaikan produk-produk pelancongan meneroka strategik ketibaan pelancong kedatangan pelancong tugas bahu semata-mata dilaksanakan menyokong kempen Melawat ASEAN menyambut menyokong visi Transformasi TN50 digagaskan Mamanda TN50 bersifat inklusif pandangan idea aspirasi hala tuju national discourse merangkumi segmen belia wanita ilmuwan budayawan ulama sebagainya TN50 visi menjadikan persada lepasan latihan teknikal vokasional TVET pekerjaan pengajian diperkasakan inovasi diperkenalkan mempertingkatkan insan berkualiti akses mengira had umur lokasi sejajar perkembangan Revolusi memerlukan berkemahiran bakat sains inovasi STI melonjak kompetitif insan merangkumi lapisan Asli Semenanjung peribumi Sabah Sarawak dilihat memegang profesional murni komuniti diteruskan bersama-sama menyumbang arus Ahli-Ahli mengukuhkan kesepaduan integrasi pelan pelaksanaan Pelan Perpaduan Kesepaduan Penyatupaduan digubal berteraskan Perlembagaan Rukun pelan kelak menentukan hala tuju arah menyatupadukan Janganlah cepat berpuas hati usaha-usaha memupuk perpaduan dilaksanakan berbeza pendapat namun gunakanlah saluran berhemah melibatkan mencampuri urusan dalaman mengamalkan prinsip wasatiyyah kesederhanaan menyokong segala inisiatif dilaksanakan unsur penghinaan agama Islam institusinya ditangani kebijaksanaan ketegasan langkah-langkah dilaksanakan menangani penyebaran ajaran menyeleweng Islam massa laman web dipertingkatkan termasuklah meneruskan pemerkasaan undang-undang pentadbiran agama Islam kesepakatan pemimpin-pemimpin Islam dialu-alukan sebagaimana menangani minoriti Rohingya Myanmar kesempatan sukacita kunjungan Sesungguhnya lawatan mengukuhkan kedua-dua mengalu-alukan menganjurkan Tergempar Menteri-Menteri Islam Situasi Minoriti Islam Rohingya Kuala Lumpur Sesungguhnya bermakna mencampuri urusan dalaman sesebuah sebaliknya konsisten penentangan kekejaman penindasan dilakukan Palestin saudara sesama Islam sedunia dukacita penyelewengan ketirisan rasuah pembocoran terperingkat penjawat penjawat dilakukan segelintir namun menghakis kepercayaan mengalu-alukan terlibat muka pengadilan terlibat pemberi rasuah memiliki dokumen terperingkat kebenaran bersyukur persediaan menghadapi bencana banjir melanda hampir tiap-tiap bertambah terbukti usaha-usaha bantuan diberikan agensi-agensi swasta badan sukarelawan terutamanya sukarelawan Angkatan penyaluran bantuan mangsa banjir baru-baru disambut dihargai terlibat persefahaman mangsa banjir diteruskan mengalu-alukan melaksanakan mitigasi banjir menghargai sumbangan mengharumkan nama kepimpinan akademik sukan kesukarelawanan kesenian sumbangan pengorbanan anggota-anggota Angkatan Tentera mentadbir membangunkan mempertahankan dihargai menghargai segala kerajaan-kerajaan terutamanya menangani cabaran-cabaran mendatang demi kesejahteraan yakin walau cabaran halangan hadapi selagi bersatu niat berusaha bersungguh- sungguh jujur kejayaan milik berdoa semoga tercinta rakyatnya dianugerahkan taufik hidayah maju aman sentosa hidup bersatu padu lindungan-Nya 
DR-09032015,2015-03-09 00:00:00,10, Bil K N D U N G N TITAH UCAPAN SERI PADUKA BAGINDA Halaman Halaman Diterbitkan Cawangan Penyata Rasmi AHLI-AHLI Mulia P S M S P D K S U M W P G D K J S M J P P G D K S D K - D I M P S M P K M N - I S P D K S S P S S S J S I M P D P M S D S P P N S I P S M S P M P S P M J S M J P I S S I D S S S S P J K - S S P S P M P D M S M M P K T - S P M P S S P S I M P D P M J D S P P N S D G S M - D G S M S S P D I M P S M P - P G D K D S P D M S M J P - - P G D K S D K J P - P G K P S M N S - S S P D P M P D M S M M P P P T P J K J P S P M P S J M K - - P J N K M N P J K - S S P D I M P D M S M D K - S P M P D P M P M P P P T J P - Anifah bin S S P D I M P P G D K S D K J P - P S T D I M P D S N S D S D K P T J S M K T K M N M K P J M - - P G D K S P D K P S M J P - P P D P S P G K P S P P - P G K S - D S N S D M S M D S M J P K M N M N P M C P J K K C D S P - P J N J S K M N - S S P D G S M S I M P S J M K D M S M P J N D S D K D S P K M N D I M P - S S M Z D P M T P J K - - - - - D I M P D K - K M N - P G D K D M S M - M P D P M P D P S M D S P S M S P J K - - D P M P D P T J K M N M P P P T J P - D M S M S D K - D K S D K J P P G D K - D I M P P K C - D M S M P J K D P S M - P S S P P P P S P P D - P J N P S J S J S M - - - - P J N P I S - P J N M N P I S - - - D P M P D M S M K M N M P J P - K M N P P N - K M N P J K - D S M Z D I M P - P G D K S D K D K J P - S P P M P P K C D I M P - D P M P D M S M M P P P T P J K J P P S S - D M S M - AHLI-AHLI BN P J N - D S M S - D M S M S S P P J N D P M K - P J N D I M P J P S P D K - P G D K J P - D I M P P K C - D I M P S M P M P - J K P G K - D P T J - D C S M D M S M K M N P J K - P J N - J K P S S - - P S M S P D K D G S M S I M P - - - D P M K - P G D K S D K D K - M N P S K - P G D K - - D P M P M P J P - P S P S S - D I M P - D I M P J M N K M N C M P P J P J P - - S S P D I M P S P S I M P S P M P - P J N D S I S - P M N J P S P D K S S P P N S P G D K - D S P N M N - - P G D K S D K - D M S M D S M C M P J K Alor - - - J M N - J S M P G D K J P D K P G D K J S M D K S K - D S M C M N S P J K P D M S M - P P - P J K - S U M W S P N S P S M D S N S P M C - S I M P D S D K D M S M J P D I M P D S M M K K M P J K - D P M P M P P P T - P N S P G K J S - D S D K M K K M - - D P M S D M S M K M N S P J K J P - - D P S M Kota - - D S P D M S M - M N - P G D K - S P M P D P M P P M P - D G M K D S S S D K M K - D S D K K M S K - P G D K - D I M P S S P - K M W P P N - - P G D K S D K J P - P J K - P M P P J K - P S M S U M W - D P M P S M S P P N P P T - D G S M D S P D S N S - D K S P M K P S M S S P S P M S - S S S D S S J P - - D P M P M P - D M S M - P P P S - P S M P N S P G K M N P S - D M S M S M P - N S P M C P J K - AHLI-AHLI Batu D I M P M P P P N D S D K D S S P T P C M S M S C M M S K M N K T P P P P P M N M S D S M D M S M D M P M AHLI-AHLI 
