paper_id,date,last page,content
DR-07032017,2017-03-07 00:00:00,90, mengira ideologi fahaman dikesan membuka diplomatik China menyertai Negara-negara Terkecuali 70-an pasport sering berkuasa dipilih pasport berkuasa Arton Capital Passport Index warganegara memasuki buah memerlukan visa Namun menyatakan kebelakangan sering tumpuan insiden menjejaskan imej pembunuhan Kim Jong Nam Lapangan Kuala Lumpur menjejaskan hala Korea Utara Setakat Korea Utara enggan pembunuhan kedua-dua suspek wanita terlibat berdepan hukuman mati Meskipun mengesyaki Kedutaan Korea Utara terlibat pembunuhan menyeru Korea Utara Malangnya enggan berbuat setakat perlindungan imuniti diplomatik Malah tuduhan berasas Korea Utara mengatakan Korea Utara mempercayai penyiasatan kritikan Korea Utara bersopan melanggar undang-undang menyokong segala memutuskan diplomatik Korea Utara demi mempertahankan kedaulatan imej akhiri mengingatkan peranan tanggungjawab Ahli-ahli Berkhidmatlah penuh dedikasi berintegriti bersama- merealisasikan amanah inginkan kesejahteraan kemakmuran perkembangan terpelihara Marilah berpolitik matang bertanggungjawab berpegang prinsip moral dikongsi atasi hadapi bangsa percaya perpaduan keharmonian berbilang kaum agama budaya harus dipelihara dipupuk generasi generasi seterusnya Kepelbagaian kekuatan kelemahan menggunakannya memperkasa membangunkan yakin hadapi diatasi berkesan sekiranya bersatu fokus berusaha Marilah berpegang penuh bermakna tercinta maju kesejahteraan memohon mencadangkan Menjunjung Daulat Tuanku jemput Bismillahir Rahmanir Rahim Bismillahir Rahmanir Rahim Membaca sepotong doa sehati sejiwa terlebih dahulu melafazkan rasa syukur hadrat SWT inayah-Nya kesempatan membahaskan Menjunjung di- menjunjung Tuanku mengingati mahupun pembangkang akur sentiasa ingat sumpah taat setia menumpahkan taat setia berbelah bahagi memelihara melindungi mempertahankan Perlembagaan tanggungjawab mendukung saranan nasihat bersama-sama berganding bahu barisan pentadbiran rintangan cabaran bakal dihadapi taat setia pemerintah tuntutan umat Islam berdoa SWT melakukan perbuatan beradab sopan keinsafan berteduh payung keimanan memohon dikekalkan kesinambungan nikmat keamanan dijauhi segala malapetaka menjejaskan membangunkan agama bangsa kesempatan merakamkan tahniah ahli-ahli kesempatan melaksanakan tugas tanggungjawab mulia siap diubahsuai kesempatan merakamkan fikir terjadi fikirkan bertanding bertanding kalah ketiganya penuh yakin kepimpinan memperoleh pertiga majoriti merakamkan tahniah dahulu rakan-rakan pasti indah cantik setengah duduk masuk cantik Ahli-ahli ceria kehadiran dapati hawa dingin sejuk sejuk lihat demi tandas ketawa kerusinya balik-balik tahan dek cuaca Suhu suhu keduanya dapati kerusinya empuk diduduki nampak Ahli-ahli ceria pasti tidur menggelongsor kerusi ketawa kerusi kerusi diduduki agak menggelongsor sedikit sekejap tarik belakang menggelongsor cuba cari adjust tapi jumpa kerusi agak canggih diadjust menyebabkan selesa melihatkan suasana ceria tanya mula tanya setuju pengubahsuaian House Committee diberikan menyertai dipersetujui user friendly nampaknya user friendly alasan menyekat memuatkan cadang Berhomat setuju panjangkan sekurang-kurangnya dulu komen sebentar ketidakpuasan hati sedikit sebenarnya indah silap rasa suasana meriah cuma sempat rasa sambung ketawa berpendapat confirm sambung meletak tapi pandangan punya pandangan baiknya sikit tuntutan ketawa kesempatan merakamkan setinggi-tinggi tahniah penghargaan lawatan Raja Salman bin Abdul Aziz Al Saud penjaga masjid suci berkunjung julung kalinya kehadiran kurang keluarganya berkunjung buah kapal mengangkut keluarganya kunjungan hormat berpendapat jalin erat khususnya terkenal kekayaannya kekuatannya aspek berpendapat diplomatik Arab Saudi diletakkan Bermakna Arab Saudi yakin yakin datangnya pasti percaya mana-mana Mana-mana pasti menyukai lawatan mana-mana pendapat sering bincangkan hampir lalu isu-isu bangkitkan lawatan percaya spekulasi anggap dahulu terhakis termateri Petronas Aramco memaju seterusnya mengendalikan kilang penapis minyak Johor kurang RM30 Tahniah pertemuan membanggakan perjuangan Islam dikurangkan kuota mengerjakan haji perbincangan bersetuju menaikkan kuota haji Tahniah Tabung lupa pertambahan kuota percaya lawatan perkara-perkara diumumkan Perbincangan perkara-perkara melibatkan lain-lain pasti berbincang seterusnya Arab Saudi yakin kesempatan merakamkan khususnya sudut kelihatan gentar langsung menyelesaikan bantahan Myanmar melahirkan rasa keprihatinan Rohingya dizalimi Sukacita mengucapkan tahniah Sekejap habiskan sedikit kesempatan rakamkan tahniah Rohingya kemanusiaan selesaikan Silakan mendengar teliti perbahasan jelas dilakukan dilakukan lawatan China umpamanya jelas bukanlah dikatakan bankrap sebagainya suara-suara sumbang mengatakan bankrap susah jelas erat berbilion kata-kata kata-kata khayalan igauan buruk pendapat tanya dulu tanya King Salman derma jumlahnya masuk akaun siapa Serai berpendapat dikatakan Serai agenda- agenda dibincangkan pengetahuan Arab Saudi senang Arab terkenal kekerasan hatinya kekuatan mental fizikal mempengaruhi firm persoalkan Arab Saudi Israel maksudnya duduk andaian sebagaimana andaian apa-apa andaian tanya andaian Israel diterima Sedangkan menuduh Silakan Bolehkah pembangkang mengisytiharkan sumbangan donation Pembangkang silakan Sedangkan bersedia isytiharkan donation Bolehkah meminta Betulkah Betul mulia isytiharkan pemberian siapa George Soroskah Raja Arab Saudikah mana- menyumbang timbul berani isytihar tutup cepat karaoke tengok sepuluh tutup marah fasal karaoke sampai cerita isteri suruh tutup cepat karaoke Ketawa suka suka menjana sebut karaoke sebut shopping complex suka shopping complex mengakui Arab memang derma King Salman isytiharkan isytiharkan tanyalah mewakili Israel George Soros Israel dibenarkan Israel derma bertanya putar belitkan tanya putar belit memulakan putar belit terpaksa putar belit Siapa putar belit dahulu Nampaknya Siapa putar belit dahulu timbul timbul sebut donation sebut janakan timbulkan pusing bising pusing cakap karaoke suruh tutup karaoke tengok mana-mana soalnya bangkitkan sifat fahaman ketepikan perpaduan ummah ni terjamin kekacauan sesuatu berita-berita kesan Tabung merakamkan tahniah tambahan kuota haji berani berjuang Maknanya flotila sanggup Bangladesh Myanmar waktu perjalanan belayar ditahan tentera Myanmar panggilan tolong Bos tolong bos kena kepung tentera Hishammuddin Bertambah hitamlah jawabnya kurang Bangladesh selamat Hishammuddin ulangi ungkapan waktu panggilan sebenarnya Hishammuddin sahih rakamkan tahniah cerita berani North Korea cerita fasal North Korea cerita fasal North Korea cerita fasal lari cuma tambah sikit lari lari cuma tambah sikit - kawan-kawan pakat Sebenarnya bersama-sama Kulim bersama-sama wakil DUN bersama-sama terbukti nyata jelas arah perpaduan menjaga ummah konteks kemanusiaan pandangan layan wayar putus teruskan Thank you for the information thank you for the information tanya tanya - selalu bergabung berkawan MITI Kelantan musuh dua-dua beritahu misi-- ulang putus wayar faham beritahu jelas menyatakan sesungguhnya bersatu ummah misi kemanusiaan sebut UMNO-PAS bersatu lawan Maknanya takut takut UMNO- betul-betul bersatu bumi bertuah North Korea South Korea pergilah duduk sebenarnya katakan bercakap perpaduan ummah Maknanya itulah jalinan perhubungan sesama tengok video sebagainya suasana sedemikian rupa lari duduk dengar habiskan Duduk duduk duduk kasihlah cabut sempat suruh tutup karaoke lari tahan 
DR-07032017,2017-03-07 00:00:00,100, Sebenarnya tahan sejuk salahkan tahan sejuk itulah sebenarnya dilakukan-- menyebut ADUN Kulim-Bandar suasana sedemikian kisah Palestin sanggup kebal sanggup kebal sebagainya sanggup berjuang perpaduan ummah sebenarnya berbaik berbaik pertahanan nampak kepimpinan Hishammuddin mewakili Lembaga Tabung Angkatan Tentera bayaran dividen sebagainya RM685 kebaikan ahli-ahlinya sebenar sentiasa prihatin setempat berkhidmat aset RM9 LTAT pentadbirannya melibatkan 9952 pencarum skim perumahan kekuatan kebajikan Angkatan Tentera bersara bersara mestilah perhatian lari masuk Korea Utara mesej ditahan silap ahli-ahli petugas kedutaan Korea Utara ditahan semangat ditunjukkan semangat ditunjukkan tolong kebaikan tahan tebusan pastikan petugas Kedutaan North Korea menyarankan ditahan dibenarkan keluar menyarankan ditahan dibenarkan keluar dibenarkan keluar dibenarkan keluar kena tahan benar keluar kena tahan maksudnya kebijaksanaan pakar-pakar membincangkan hal Hishammuddin hantar North Korea ingat diri berani tawarkan diri rasa Bercakap pembesar suara ikut percaya diplomatik diplomatik dilakukan duta Diplomatik kurang ajar panggil Wisma Putra hadir mengenali berperlembagaan kuatkan institusi raja Kekuatan raja kestabilan bersikap sedemikian rupa keluar - silakan mempertikaikan cara mengendali Sedangkan nampak seolah-olah Korea Utara mengiktiraf berdaulat ulasan Sebenarnya selalu merakamkan tahniah Sebenarnya tentera selalu siasatan segera penyelesaiannya Tengok pembunuhan Korea Utara singkat mengesan Maknanya punya kekuatan berbagai-bagai sudut digunakan melambangkan kekuatan menjamin kestabilan kestabilan kestabilan anggota-anggota bertugas melaksanakan tugas sering katakan masuk kancah pertengkaran pertelingkahan sikap sedemikian rupa terpaksa lakukan menjamin Korea Utara terpaksalah melakukan sedemikian rupa Korea Utara memang kekuatan peluru berpandu nuklear bimbang kena awasi kena jaga bimbang tinggal tengah-tengah ibu kena fikirkan katakan pakar-pakar lengkap diketuai KDN penyelesaian rundingan sulit terjejas disebabkan jangka Sedangkan melawat berhati-hati hal memastikan-- berlandaskan undang-undang Konvensyen Vienna diplomasi Kota pendek Kota pendek wassatiyyah prosper thy neighbour constructive engagement bantu mendamaikan Mindanao Somalia Palestin baru-baru kelompok Flotilla Rohingya maknanya damai sentiasa bantu Korea KLIA Korea terbunuh dipertikaikan perundangan kedaulatan statement tegas halang meninggalkan arahan menghalang keluar pandangan Ahli- bersatu belakang menghadapi potensi jauh patut kesempatan sama-sama berdiri teguh belakang kepimpinan pandangan sahabat Sedikit cuma rekod mulia makluman rakan-rakan sebelah sebenarnya sebelah menyokong segala menyelamatkan North Korea sesuatu melibatkan rasa bersetuju Kota bersatu menangani Kota rasa terharu menzahirkan perkataan hal bersatu hati Korea Utara permainan Bapa saudara tembak peluru berpandu tertidur bapa saudara peduli tembak peluru berpandu padahal pakai A16 pakai pistol mati hancurkan perangai setuju hal bersatu padu kekuatan jiwa kental menghadapi segala perjuangan rupa mestilah bangga mewakili sebelah sanggup sedemikian rupa konteks tanya sokong Batu perdebatan perbahasan serahkan bersesuaian berbahas pendirian Pendirian Pendirian bersetuju Bersetuju Korea Utara muktamadnya Muktamadnya menghadapi Daish sebagainya kena bersatu hati pejabat-pejabat tengok pergerakan gate nampak Maknanya nampak crest wakil gate segera crest diberhentikan tepi Kaedah-kaedah kena kaji gerak gerak sebagainya kena fikir Ahli-ahli wakil Bayangkan pembukaan terjamin tengok masuk pemeriksaan pemeriksaan Sepatutnya scanner sebagainya bimbang hal tengok kelekaan pembunuhan airport berpunca sedikit kelekaan tahniah bersatu hati mempertahankan kedaulatan anak-anak cucu sebagainya hal Silakan tanya disebabkan tahan tahan tahan keluar North Korea bersetuju United Nation resolusi sanctions against South Korean terang-terang menahan berdaulat keluar bersetuju diri bersetuju tapi serah mempertimbangkan sebagainya dianggap diperbahaskan mengharapkan perkara-perkara ancaman kena berhati-hati kena berjaga-jaga menteri umpamanya kawalan selamat Sebiji diletakkan habis bergegar situasi hal menyentuh sedikit menyentuh khususnya kesinambungan dibawa berbagai-bagai bawa berbagai-bagai kebaikan lihat sedikit perubahan getah membanggakan pastilah transformasi dilancarkan KPI NKRA purata ditingkatkan bersetuju penyokong menyokong saranan disarankan awalnya dikritik sebelah Walau pencambahan khususnya menggambarkan bertambah mestilah bersama-sama sebenarnya memperkukuhkan sampai lawan sampai waktu kesejahteraan kena bangsa agama sebagainya kedaulatan mengharapkan sebagaimana dikatakan sebentar kenikmatan berbagai-bagai khususnya Pan Borneo CSR terbaru East Coast Rail Link ECRL dibina menuju pantai timur Menuju pantai timur Lembah Terengganu seterusnya Lembah pelabuhan darat menjana sokong bercakap mulia lalu sebenarnya pelabuhan darat nampak menjanakan menaikkan menaikkan sebagainya Kuala Kuala Lumpur tapi lupa pelabuhan lupa Terengganu pelabuhan sebutkan sedemikian rupa nampak KTM senyum ruang KTM hal menyarankan pelabuhan darat Kuala Lumpur dilaksanakan menaikkan taraf katakan sebentar katakan lebar mulia mengharapkan peniaga-peniaga tapak kilang sebagainya tumpuan tumpuan Lembah mengharapkan Parlimen-parlimen daerah-daerah menghubungkan katakan sedemikian rupa lupa jaringan pengangkutan efisien MRT penggunaan menghubungkan Kuala Lumpur sehinggalah Maknanya berbagai-bagai aspek maju menikmati kemakmuran katakan sara hidup kitalah merancang sara hidup katakan pengangkutan menghubungkan Kedah umpamanya maklumkan tiket kadang-kadang penggunaannya dikaji penjimatan minyak menjimatkan bayaran tol sebagainya cut cost belanja mewah termasuklah katakan pusat-pusat hiburan benarkan dahulu Maknanya biasa tutup berselerak kota metropolitan khususnya Kuala Lumpur khususnya kawasan-kawasan Selangor dicampur melebihi 10000 terpaksa dikawal menjejaskan rasa keseronokan kesedapannya inilah berhibur habis duit lupa bini katakan sedemikian rupa lari keluar mempertahankan pusat-pusat dengki karaoke dengki gembira berjimat mengharapkan menikmati kemakmuran sara hidup bantuan diberikan Bantuan dinamakan BR1M Baucar Buku Kedai Klinik berbagai-bagai sebenarnya sedikit menyentuh BR1M Bantuan baca Baca penerima BR1M mendaftar SSM BR1M kurang angkanya SSM kena ingat BR1M ditapis Lembaga Malaysia-- ditapis disebabkan mendaftar SSM bantuan BR1M kononnya berniaga mendaftar BR1M daftar SSM berniaga berniaga seberapa nasi lemak tepi umpamanya katakan mengata daftar SSM Hendak pinjam TEKUN kena SSM pinjam berbagai-bagai SSM Lembaga menolak membayar cukai ditolak BR1M perhatikan betul-betul Silakan Silakan rasanya bersetuju pendapat SSM cara menolak penerimaan BR1M menimbulkan muda sepatutnya galakkan berniaga mendaftarkan SSM tentu berniaga menjana melebihi RM3000 RM4000 diharapkan cut off BR1M tanya setuju sekiranya berwajib lupakan SSM kelulusan layak BR1M digunakan SSM sedangkan digunakan tanya dengar mendaftar SSM layak BR1M BR1M RM4000 RM3000 bujang RM2000 tanya datangnya cerita benda viral- kan mengatakan daftar SSM faham bawa buku statement buku akaun Lembaga menepati syarat which one is correct this is by the Communication Director of benar berdaftar SSM layak BR1M Permohonan ditolak rekod permohonan melebih RM4000 BR1M dilaksana dijadikan BR1M dipolitikkan sebegini rupa So rakan-rakan bersetuju sedikit Part sebenarnya harap tukang urut ditolak berdaftar SSM-- bertulis Resit resmi dikeluarkan LHDN Ditolak berdaftar SSM benda bercakap dokumen dikeluarkan semak betullah benda tipu PS bersetuju Kejadian terjadi kenal mendaftar pendaftaran SSM kosnya is affordable-- terlampau murahkan RM2 registration makluman data mengatakan SSM layak keadaannya berlainan bertanya start up diumumkan memulakan start up itulah terjadi dibetulkan negatif impak komen sebenarnya mungkinlah-- disebabkan faktor dikatakan benar faktor dikatakan rakan-rakan benar sebenarnya bangkitkan angka-angka sebenar mengatakan BR1M kakitangan bercerita memang daftar SSM berniaga 
DR-07032017,2017-03-07 00:00:00,110, bangkitkan hal sebelah kiri kanan kebenarannya bercakap menuduh mana-mana fakta katakan perbahasan Menjunjung sebenarnya mana-mana benar di-viral-kan viral benar benar Gambar ubahsuai dahulu berbagai-bagai tohmahan katakan WhatsApp FB kadang-kadang percayai walau tetap siasat hal sepuluh baca Nama Saedah binti Che Alasan BR1M ditolak Tanggungan pengesahan SSM jelas Rasmi dikeluarkan berkuasa mengatakan makna mengelirukan mengelirukan mengelirukan diberikan sepuluh Ketawa kurang kurang bertukarlah tajuk Varatharaju Naidu Batu BR1M Sikit sikit Sikit Varatharaju Naidu Batu Berhubung kaedah pembayaran BR1M Dahulu memang BR1M dimasukkan akaun tiba-tiba perubahan kaedah pembayaran BR1M terutamanya kawasan-kawasan tertentu baucar BR1M diberikan ahli-ahli tertentu Umpamanya kumpul baucar menyebabkan kekecohan terlalu baucar sampai pengsan rasa kaedah diguna pakai berbalik kaedah masukkan akaun tiba-tiba perubahan penjelasan ulas sikit tajuk beritahu kurang habis waktu Sebenarnya pemberian baucar online dikatakan katakan BR1M dimasukkan serbu sehinggakan out baucar berperingkat-peringkat fikirlah kaedah kaedah gunakan jammed Batu ambil duit ambil duit Terpaksa pengsan Ketawa kaedah kaedah kurang tukarlah tajuk sebut tinggal sepuluh pengkajian khususnya sebagaimana dinyatakan perubahan dilakukan TN50 Transformasi disarankan menyokong hal menyebut TN50 Lenturkan buluh biarlah rebung kurang sampai TN50 Sasarannya transformasi percaya cerucuk membina kekuatan digunakan mileage inisiatif isteri Rosmah PERMATA bijak tepat mencorakkan generasi pelapis Maknanya PERMATA memulakan Maknanya nampak TN50 memang nampak kesan seharusnya kanak-kanak akses perkembangan asuhan prasekolah berkualiti bersedia sekolah khususnya berusaha kanak-kanak hak walau murid jauh pedalaman berbagai-bagai akses Memulakan transformasi biarlah dijadikan silibus menzahirkan TN50 anak-anak diajar sepenuhnya Namun kajian khususnya selalu kompelin jalur lebar ingat sebagainya dinamakan 1BestariNet menampung kekuatan Internet sekolah Guru-guru kadang-kadang terpaksa mencari bukit mengakses melakukan gerak menyiapkan terpaksa cari bukit internet berkuasa laju menyelesaikan YTL YTL bertanggungjawab 1BestariNet Batu YTL kena hal sekadar bertanggungjawab hal menyebabkan perguruan terganggu Batu bersetuju Batu Batu menyokong pendirian bersetuju batalkan provider dibaiki katakan Bolehkah cadangkan tertarik perbahasan jalur lebar seolah-olah Chipsmore Kadang-kadang laju kadang-kadang laju bersetuju dilibatkan internet benar-benar bersedia memilih syarikat-syarikat benar-benar berwibawa tertentu pelanjutan Misalnya gagal harus menamatkan syarikat-syarikat berwibawa anak-anak anak-anak dijadikan seolah-olah makmal test sambung merugikan Apakan pandangan menyokong gagasan YTL disemak 1BestariNet dilaksanakan kurang berbagai-bagai kelemahan diatasi berniat mengimplementasikan ditugaskan agak menyokong gagasan dibatalkan pelawaan diberikan pembekal sokong penuh Batu sangat-sangat bersetuju selesaikan selesaikan selesai tukar ambil cakap bergantung berniaga action bercakap Maknanya sejauh bercakap setuju cakap menyokong ucap kasihlah disokong bagilah sikit sekolah-sekolah RM5000 RM10000 guru-guru pakai duit poket tukar lock tukar engsel pintu sebagainya langsung stok duit Tok Det fikirlah sikit Maknanya sekolah agak terbatas sejam setengah maknanya sampai Sampai tambahan Bagus tambahan hidupkan timer sama-sama kegunaan hidupkanlah So pentadbiran hidupkan timer timer bawa ringkas kampung cadangkan PS menyokong cakap sikit PS bawa sikit sekitar umpamanya sedikit sekitar tekankan ucapannya berpandukan berfaktakan pesat penggondolan dilakukan Sepatutnya lombong emas bauksit sebagainya menanam pokok-pokok supaya- nampak kekerapan banjir kan tiap-tiap banjir punca fikirkan pengawalan banjir terbinanya Empangan Jelai Hidro melepaskan pastilah campur hujan masuk melawat sedikit sumbangan kasihlah tubuhkan Renjer Hutan jaga jaga Renjer Hutan fikirkan tebatan banjir ketinggalan sekitar sekitar hujah tertinggal sokong sekitar memang pandangan tolong hujah dikatakan Pahang dikatakan hutan ladang sekitar bercakap food security cakap tebatan banjir KPKT kena fikirlah tebatan banjir asik fikir KPKT ingat KPKT fikir tengok banjir tengoklah sikit pasal campur cakap pasal campur floor floor bercakap kasihlah tolong sebenarnya bagus tolong Ahli-ahli soalnya banjir maknanya fikirkan tebatan banjir Maknanya pelepasan kena tengok kena lihat maknanya Renjer Hutan Angkatan kena tengok penggondolan- penggondolan hutan tajuk puas hatilah kaitan banjir Sikit Bolehlah Sikit bercakap sekitar banjir Memang berkait rapat penggondolan hutan banjir merasakan beria-ia menyelamatkan sekitar tapi Pahang dipanggil pembukaan ladang hutan sebagainya mengundang terkawal Kelantan misalnya polisi betul-betul memelihara sekitar Akhirnya banjir kilat perogolan hutan-hutan habiskan Sebenarnya bersetujulah penggondolan hutan anugerahkan projek-projek ganti pokok-pokok idea bercakap suruh bercakap Mungkinlah duduk sebelah bercakap sebut Pahang Insult insult sindiran Insult to me if I don t have my own brain tarik Ketawa sebut sikit pandangan minyak ambil Indonesia Indonesia silap nama stesen minyak Pertamina Indonesia subsidi stesen minyak contohnya Petronas Indonesia subsidi bayar Shell bayar Petron bayar lain-lain stesen minyak subsidi kena tanggung bayar Petronas bayar stesen-stesen Petronas subsidi subsidi subsidi maknanya jual minyak juallah sebenarnya perbezaan stesen minyak Petronas stesen minyak Shell Petron bayar gelak bawa harta duit subsidi keluar fikirkan fikir subsidi Shell Petron subsidi Petronas Petronas melabur kembali kembali gunakan Indonesia Pertamina Akhirnya jaga food security kena jaga sampai putus sebenarnya RM17 mengimport barang kaji harga-harga kajian meletakkan food security menyarankan meletakkan tanggungjawab FAMA dijaga Sampan dipukul riba goyang-goyang seimbang pandangan idea disebut harap-harap dipertimbangkan Wabillahi taufiq wal hidayah menyokong Wabillahi taufiq wal hidayah wassalamualaikum Harap-harap ditimbang jemput diperuntukkan Bismillaahir Rahmaanir Rahiim Membaca sepotong ayat Al-Quran Segala pujian-pujian Maha Maha Mendengar Maha Mengetahui terang tersembunyi hati selawat junjungan Rasulullah SAW kekasih Nabi SAW teladan rahmat terlebih dahulu merafakkan sembah tahniah Sultan disampaikan mulia titah ulung Duli merasmikan pembukaan pembangkang melahirkan rasa terharu terkesan menyentuh mengamati umumnya menyentuh perihal kedaulatan cabaran-cabaran permasalahan bebanan hidup dipikul samping isu-isu menyentuh wanita sekitar isu-isu samping melahirkan rasa dukacita kecewa penyelewengan ketirisan rasuah pembocoran terperingkat penjawat penjawat memulakan membahaskan Menjunjung peringatan diri hadir mulia kemuliaan Firman SWT mahfum-Nya tolong menolonglah kamu mengerjakan kebajikan takwa tolong-menolong berbuat dosa pelanggaran bertakwalah kamu sesungguhnya berat seksanya Surah Al-Maidah ayat seminggu dikejutkan gula Gula gula RM2 RM2 sekilogram sebaik diesel RM2 RM2 seliter data IHP disiarkan Perangkaan lalu inflasi IHP IHP ketara melibatkan antaranya kubis bulat Minyak masak sotong udang ikan kembung ikan kembung Terkejut pasar basah naiknya Ikan tenggiri ikan merah inflasi disiarkan gula diesel baru-baru gula Jelas sara hidup impak menimpa pelajar universiti kesan Bajet peruntukan universiti-universiti RM7 RM6 pengurangan RM1 pengurangan balas aduan pelajar-pelajar IPTA IPTS aduan permasalahan akademik menjejaskan pelajar Antaranya yuran akademik kena bayar parkir pengurangan akademik pensyarah pembiayaan penyelidikan akademik berkurangan yuran dikenakan menjejaskan persatuan-persatuan mahasiswa Inilah membina mahasiswanya akademiknya sahsiahnya personalitinya membina insan berkualiti berkaliber kesan domino akibat gula terbaru tentunya menaikkan minuman pasti pengalaman dulu apa-apa menaikkan kedai mamak minum teh tarik bebanan dipindahkan disebabkan kejatuhan nilai malah akibat cukai GST berkuat dikatakan inilah menyelamatkan menanggung persoalkan sara hidup bebanan bertambah gaji upah tentunya mencukupi Gaji minimum diumumkan tentunya mencukupi seharusnya menyemak kembali gaji minimum wajar ditetapkan gaji Penyiasatan Perbelanjaan perbelanjaan penggunaan bulanan purata RM2190 RM3578 perbelanjaan penggunaan RM1388 setahun Data dinyatakan pembangkang asyik-asyik 
