paper_id,date,last page,content
DR-07032017,2017-03-07 00:00:00,40, sebut USD100 bayar subsidi faham minyak jatuh USD30 per barrel kehilangan hilang habis USD per barrel minyak USD per barrel income petroleum tax RM27 billion jatuh USD30 tax petroleum cuma RM8 billion Kemudian Dividen waktu USD100 per barrel Petronas dividen RM29 billion last year RM13 forecast cuma RM13 RM16 Kemudian royalties dulu RM6 RM3 So penurunan income kena faham minyak jatuh kena this is the concept tengok tengok one side you have to see both side implikasi Amrin Buang tenang tanya statistik beritahu statistik diberikan Amrin Buang Amrin Buang beritahu check Auditor General suruh tunjuk figures menyatakan perbelanjaan tiris jumpa menafikan angka-angka tersebar luas tengok Auditor General punya report duduk berdialog duduk dibenarkan bertanya tambahan bersetuju tegakkan benang basah berhujah pendek Bung Moktar bin Raden Memang tanya memang pendek kena penjelasanlah penjelasan diberikan subsidi minyak rupanya Minyak petrol minyak diesel minyak makan Pokoknya asal minyak memang subsidi mengkaji benda-benda direalisasikan harganya terbela mutakhir rata-rata dengar minyak masak bersubsidi langkah-langkah beban sebegini harus bela nasib menyokong sebut subsidi-subsidi diteruskan cara pemberian subsidi bersasar ambil meneruskan subsidi padi benih padi baja padi and then padi one over billion million padi subsidi baja padi benih padi kemudian minyak masak Now issue subsidi minyak masak kemudian minyak masak KPDNKK penguatkuasaan subsidi subsidi ditukar sempadan-sempadan minyak-minyak keluar nampak brand supply minyak masak subsidi penguatkuasaan menyatakan status terkini pengiktirafan pengajian Diploma Vokasional MQA Sekolah Menengah Vokasional SMV dinaiktaraf kolej vokasional Chong Sin Woon Transformasi Vokasional TPV bertujuan mengarusperdana vokasional setanding aliran perdana Transformasi mencorak landskap berteraskan pencapaian kompetensi kemahiran akademik Matlamat TPV melahirkan separuh mahir mahir sasaran melanjutkan pengajian usahawan Malaysian Qualification Agency MQA menjalankan verifikasi penilaian pengiktirafan Diploma Vokasional MQA selesai verifikasi akreditasi penuh pelaksanaan diploma kolej vokasional rintis menunggu akreditasi timeline tetapkan MQA ucapkan akur dinyatakan tanya tambahan langkah-langkah pelajar-pelajar diploma kolej vokasional menyambung sarjana IPTA universiti teknikal benarkan kelulusan khas pelajar diploma SPM diterima masuk universiti Chong Sin Woon tambahan matlamat diploma vokasional pekerjaan meneruskan pengajian usahawan sebenarnya majoritinya masuk memerlukan tenaga-tenaga mahir separuh mahir melanjutkan pengajian sarjana muda sememangnya memerlukan laluan bagus sekurang-kurangnya kredit diploma vokasional DV meneruskan pengajian sarjana muda IPTA diploma vokasional Laluan meneruskan pekerjaan sekurang- kurangnya adanya pengalaman memohon MQA diterima masuk pengajian lepasan DV institut pengajian meneruskan pengajian universiti diiktiraf JPA Sijil Diploma Vokasional tara SVM SPM diterima JPA pelajar-pelajar lepasan DV memang laluan jelas IPTA pengalaman tambahan diberikan sedikit penjelasan spesifik penerimaan industri keberkesanan pelaksanaan TVET setakat terutamanya aspek kebolehpasaran graduan kolej vokasional Sejauh saingan pekerjaan graduan universiti Chong Sin Woon tambahan sedikit Seramai 2273 pelajar kohort diploma konvokesyen Universiti Sains Islam Graduan KV pengiktirafan industri pekerjaan graduasi graduan KV seharusnya merebut peluang-peluang tersedia bersaing industri pekerjaan kohort memang daya saing pekerjaan menunggu akreditasi sepenuhnya MQA diiktiraf industri menyatakan langkah-langkah menangani serangan virus-virus merbahaya kencing tikus Leptospirosis seumpamanya virus misteri maut kejadian Merah Kelantan lalu terlebih dahulu ucapkan bertanya penyakit berjangkit permulaan memberitahu kejadian virus misteri kejadian Merah Kelantan kejadian wabak Leptospirosis melibatkan disahkan ujian makmal terdedah Penyakit Leptospirosis dinamik beriklim tropika kejadian dilaporkan negara-negara dilaporkan sporadic terlibat wabak Leptospirosis disebabkan tingkah laku minda penyakit berhubung kait amalan kebersihan diri kebersihan persekitaran Penyakit Leptospirosis disebabkan pendedahan dicemari kencing tikus terinfeksi penyumbang sebaran penyakit Leptospirosis makan minum premis kotor terdedah persekitaran kotor rekreasi selenggara Pencegahan kawalan penyakit leptospirosis dilaksanakan berkesan sekiranya perubahan minda tingkah laku kesedaran penjagaan kebersihan sekitar terutama tinggal bekerja rekreasi Pemilihan premis bersih mencegah jangkitan leptospirosis leptospirosis melibatkan agensi agensi sampah saliran paip pelesenan premis rekreasi tanggungjawab agensi bukannya Sehubungan komitmen agensi badan lapisan diperlukan kebersihan persekitaran keutamaan Selagi sisa diurus sempurna selagi mengundang pembiakan tikus risiko lectovirus leptospirosis Tapi sedikit penjelasan lanjut doktor perubatan terutamanya Ahli-ahli sering mendengar menyedari wujudnya satu-satu penyakit timbul ianya timbul uncertainty ketidaktentuan punca penyakit ambil Merah lalu melibatkan keluarga dikuarantin dikatakan penyakit misteri wujud pandangan diberikan mengatakan virus virus misteri mengatakan bakteria ectopic klebsiella pneumonia sebut wabak zombi gigitan gigitan Kemudian kematian doktor rawatan menyatakan cause of death severe pneumonia sejauh kekuatan institusi kajian seumpama IMR Institute for Medical Research kekuatan pakar-pakar berlakunya suasana begini finding penyelesaian menimbulkan keresahan terlebih dahulu pandangan sepatutnya jawatan-jawatan bertanggungjawab mengeluarkan kena berjaga-jaga mewujudkan suasana kekeliruan dijelaskan Ahli- menjawab dibangkit Ahli- kewibawaan institusi- institusi Institusi Penyelidikan Perubatan IMR Institusi-institusi kebolehan punca satu-satu wabak penyakit nasihat jelas institusi matang kepakaran mencukupi dikatakan kepakaran diiktiraf dikatakan taraf jenis So kebolehan institusi mengenal pasti satu-satu wabak contohnya nasihat dikatakan mencukupi selaras negara-negara Berbalik pesakit kekeliruan wujud komplikasi jenis komplikasi penyakit leptospirosis pneumonia disebabkan klebsiella So doktor punca kematian leptospirosis pneumonia mengakibatkan kematian So kematian dikatakan punca kematian perkara-perkara pandangan seolah-olahnya jenis penyakit sebenarnya puncanya kadang-kadang kes-kes leptospirosis kadang-kadang ringan tapi kadang-kadang berat sampai menjangkiti organ badan komplikasi wujud daripadanya jenis punca sudut memang pakar-pakar jenis punca dibangkitkan sudut memang mengeluarkan jenis bertindih you pandangan berlainan cuba seberapa kawal iktibar pandangan dikeluarkan Kelantan jelas leptospirosis jembalangkah hantukah benda misteri Leptospirosis penyakit bawaan dijangkiti haiwan dijangkiti bakteria leptospira bercakap fasal pertamanya tikus haiwan-haiwan lembu khinzir kuda sebagainya Konteks perhubungan Bermakna banjir taman rekreasi kolam mandi sungai sebagainya bertanya proaktif dijalankan terutamanya Pelancongan rekreasi terutamanya kolam mandi waktu banjir bebas virus leptospira pemantauan berkala dilakukan penyebaran dilakukan memberitahu bahayanya leptospirosis jelaskan tanggungjawab mengelakkan kemungkinan penyakit leptospirosis jatuh jenis agensi memang peranan contohnya pihak-pihak berkuasa lesen pusat-pusat rekreasi lalu insiden Bukit Merah Perak jangkitan virus mengakibatkan keperluan tutup kolam kolam renang waktu dibersihkan diisytihar sihat dibenarkan digunakan menghadapi leptospirosis mula beriadah terjun satu-satu terkemuka terjun tercemar kencing tikus kencing roden pencemaran mengakibatkan penyakit bekerjasama agensi-agensi berkuasa Perhutanan pihak-pihak nasihat penguatkuasaan dilakukan pembersihan dilakukan agensi-agensi kawasan-kawasan sentiasa dijaga So sedemikian agensi-agensi punca penyakit-penyakit mengawalnya mustahak amnya Contohnya pusat-pusat riadah rekreasi pusat-pusat terjun contohnya tepi sungai sebagainya membuang sisa punca pembiakan jenis haiwan rodent punca penyakit kena perubahan sikap populasi haiwan punca merebak penyakit menyatakan pelaksanaan CEO Faculty Programme Institut Pengajian IPTA impak positif mahasiswa siswi IPTA bercadang memperluaskan Institut Pengajian Swasta IPTS terutamanya dimiliki agensi-agensi CEO Faculty makluman Fakulti Chief Executive Officer CEO Faculty Programme kebolehpasaran graduan dilaksanakan lonjakan kecemerlangan bakat Pelan 2015-2025 seramai CEO terdiri industri swasta melibatkan diri universiti UA bahkan institusi swasta IPTS syarahan berkongsi amalan motivasi pensyarah pelajar tokoh korporat terlibat Azman Mohktar Khazanah Universiti UTM Universiti Petronas UTP Tony Fernandes AirAsia Universiti Putra UPM O Narayanan Motorola INTI Universiti College CEO Samsung CEO CIMB Maybank Shell sebagainya tokoh-tokoh syarikat-syarikat CEO Faculty melibatkan pegawai-pegawai ketua-ketua keseluruhannya kesemua CEO menyumbang menyampaikan syarahan perkongsian melibatkan 60000 mahasiswa staf akademik CEO terlibat Berbahagia Mohd Irwan Serigar Abdullah Perbendaharaan bekerjasama Malaysian Innovation and Creativity Centre inisiatif memulakan MasterClass Entrepreneur pementoran Universiti Kebangsaan UKM mengasuh mahasiswa arah keusahawanan keberhasilan impak pengajaran pembelajaran mahasiswa berpeluang mengikuti berteraskan modul pembelajaran berasaskan pengalaman experience learning pembelajaran berasaskan technology-enabled learning mencabar dilaksanakan perkongsian pengalaman amalan pandangan CEO pelajar berfikiran kreatif inovatif berupaya berfikir kotak seterusnya kebolehpasaran graduan ketidaksepadanan mismatch penawaran meneruskan melibatkan IPTS CEO sambutan IPTS mahupun CEO Terbaru CEO ExxonMobil melaksanakan Universiti Malaya merakamkan tahniah kejayaan CEO Faculty universiti universiti swasta Persoalan berhasrat menyebarluaskan institusi teknikal politeknik tambahan makluman CEO Faculty dilaksanakan politeknik objektif perkongsian ilmu kepakaran tokoh-tokoh industri pendedahan pelajar pensyarah sejumlah CEO fakulti menyampaikan syarahan interaksi kunjungan CEO politeknik sekitar pelajar terutamanya pelajar semester politeknik dilibatkan IPTS teknikal politeknik barangkali Kolej Poly-Tech MARA mengehadkan pelaksanaan CEO Faculty institusi memang IPTS Kolej Poly-Tech MARA lawatan benchmark visit IPT melaksanakan 
DR-07032017,2017-03-07 00:00:00,50, jayanya sejauh konsep CEO Faculty Programme dilaksanakan berkesan umum memang Pengajian bersedia berkongsi expertise pengalaman Memanglah hasrat Pengajian pelaksanaan demi kebaikan pelajar seterusnya menaikkan kebolehpasaran graduan Pertanyaan-pertanyaan Lisan mencadangkan memerintahkan menjaga jalan-jalan lorong-lorong menuju sentiasa dilalui apa-apa halangan menghalang ahli-ahli apa-apa kacau-bilau jalan-jalan menuju huru-hara Bangunan berhampiran bangunan menyampaikan perintah menyokong Ahli-ahli masalahnya dibacakan disetujukan ingatan begini didebate tanya semacam tanya gunanya apa- perlindungan Ahli-ahli semacam Shah dikejar diserang precinct sampai apa-apa dipastikan dikenalkan sampai apa-apa perlindungan diberikan Ahli-ahli meluluskan Tentulah jelas bertentangan luluskan huru-hara berhampiran bangunan jelas rules of law Rules of law mementingkan rules of law semacam Korea Utara bunuh membenarkan tinggalkan Korea Utara jelas inilah berbeza kegiatan keganasan hostage keganasan tunjuk rules of law rules of law negara- semacam Korea Utara hormat rules of law harap penjelasan memuaskan payah respons respons Ahli-ahli pengawal-pengawal lantik konvensyennya mana-mana benarkan Malahan setahu pihak- masuk penyiasatan jenayah memohon kebenaran terlebih dahulu meminta jaminan precinct Setahu memegang lalu mengingatkan Ahli-ahli ruang legar masuk persekitaran orang-orang dijemput jemputan nama Ahli-ahli menegur terlampau banyakkan jemputan-jemputan nama Ahli-ahli Malahan ingat dahulu precinct perayaan-perayaan tertentu ingat telur-telur pink dibawa persekitaran menyiasat dibangkitkan Kadang-kadang pengawal dilantik serba sesiapa masuk nama Ahli-ahli jemputan Shah dahulu Shah Duduk dulu memanggil ahli-ahlinya terdiri pembangkang mengeluarkan berhadapan bertanggungjawab persoalannya dicetuskan wakil sebelah kanan blok sebelah kiri blok pembangkang persoalan kemukakan pengerusikan bolehkah benarkan menghukum pihak-pihak tertentu berbeza dipanggil undang-undang double jeopardy Ahli-ahli bermesyuarat biarkan berbeza berterima membangkitkan hal within the precinct of Parliament spesifik Shah Pendapat peribadi biarlah melibatkan tanya bersetuju precinct perlulah keizinan siasatan menolak menolak ambil segera patutlah long delay ambil perlulah segera dilihat terlibat orang-orang blok disiakan-siakan Shah benarkan cuma Shah bercakap berbalik Shah berpandangan golongan terlibat serangan seharusnya dikenakan harus Ahli-ahli terlibat Maknanya terlibat kekasaran menyerang polis-polis kena ambil polis- kakitangan kakitangan dicederakan dihalang melakukan tugasan berwajib peristiwa Berhubung terlibat diri serah menubuhkan bertindak sekiranya didapati bersalah mencetuskan sebegitu the rules of law disebutkan dipertahankan physical violence dikenakan serangan Lalu merakamkan perasaan dukacita pendakwaan mereka- terlibat jelas dikenal pasti sewenang-wenangnya apa-apa alasan Peguam tertuduh hadir silap apa-apa penjelasan So meminta penjelasan menjelaskan timbul faham kekeruhan katakan benarkan berhujah perkara-perkara ditimbulkan ditimbulkan sewaktu perbahasan sengaja membenarkan membangkitkan bangkitkan relevan special benarkan berhujah baca tergendala sekejap Ahli-ahli masalahnya dibacakan disetujukan dikemuka diputuskan disetujukan Ahli-ahli memaklumkan memulakan perbahasan menjunjung di- menetapkan perbahasan pencadang penyokong setengah Pembangkang pembahas-pembahas memohon mencadangkan menjunjung sudi berangkat menyampaikan berikut sepertinya dipersembahkan bunyinya Ahli-ahli ampun mempersembahkan mengucapkan berbanyak-banyak syukur menjunjung membuka memohon izinkan terlebih dahulu mengucapkan kesyukuran kebanggaan pencadang menjunjung mengucapkan jutaan menghargai kesempatan Ahli-ahli hadirin hadir mulia Semoga saranan diterima difahami berusaha perkembangan diharapkan Umum terpilih memasuki wakil sentiasa diteliti dinilai mengingatkan biarpun memasuki wakil menjalankan tugas kewajipan penuh dedikasi jujur bertanggungjawab bersikap cuai sambil lewa mengabaikan kewajipan wakil melangkah masuk tetap menjalankan tugas kewajipan penuh semangat kebertanggungjawaban dipilih mandat PRU13 memimpin memberangsangkan kejayaan meneruskan transformasi selaras aspirasi pesat konsisten pimpinan rekod biarpun berdepan cabaran halangan Syabas langkah-langkah positif mengekalkan haluan Semoga diteruskan penuh komitmen daya kesempatan mengingatkan Ahli-ahli penjawat menjalankan tugas integriti cekap profesional kebaikan terdiri kaum harus sentiasa diingati wakil penjawat Demokrasi perwakilan terserlah kesedaran kesudian memainkan peranan sebaik-baiknya diharapkan wujudnya kepimpinan keseluruhannya menjamin kesejahteraan menjaga kebajikan membawakan diaspirasikan wakil sentiasa berusaha bersungguh-sungguh arah perubahan positif bersedia berkhidmat mendengar suara hati menyelesaikan Kewajipan masuk mulia harap saranan diterima Ahli-ahli berusaha demi perkembangan elemen menyejahterakan berbesar hati kepimpinan mapan bergerak arah kecemerlangan Tabung IMF dilihat subur segmen dilihat menyumbang Contohnya lawatan rasmi China berupaya memateraikan masuk sejumlah RM144 berbentuk akhir- lawatan rasmi Raja Salman Saudi Arabia diberikan kepercayaan RM46 terbanyak Saudi Arabia sejarah perhubungan memberangsangkan sikap positif ucapkan tahniah syabas Menteri-menteri khususnya EPU MITI kejayaan fakta tambahan daya saing dikeluarkan Forum dinobatkan ke-18 berdaya saing platform keupayaan mengekalkan kualiti daya saing penajaan keupayaan keseluruhannya Data jelas membuktikan diuar-uarkan pembangkang kononnya bakal bankrap menghadapi krisis tenat Keluaran Kasar GDP terakhir pakar Shah Shah tanya sekiranya disebut cantik surat khabar baru-baru dilaporkan 6000 akademik profesor-profesor universiti-universiti terpaksa dihentikan sedangkan Sepatutnya banyaklah pekerjaan sekadar jual sekadar jual dapatkan duit masuk sesiapapun Hakikatnya teruk lihat baca kehilangan pekerjaan golongan terpelajar universiti-universiti pensyarah-pensyarah Menyampuk tolong jelaskan selaraskan gambaran positif laporan-laporan disediakan hakikat on the ground tengok Khazanah melabur portfolio EPF melabur portfolio institusi-institusi memerlukan yield terpaksa melabur yield makna Laporan-laporan disediakan disediakan Disediakan IMF biar ingatkan hujah disampaikan I ll come to that biar habiskan sedikit langsung foreign direct investment RM207 merekodkan pelancong pelancongan RM69 RM82 Cara perbelanjaan berhemah nisbah hutang KDNK bertambah Transformasi ETP diwujudkan mentransformasikan menjadikan berpendapatan kasar PKN per kapita sekurang-kurangnya RM48000 mencipta pekerjaan Setakat mencipta pekerjaan RM36209 per kapita gus swasta RM114 Malangnya pembangkang menyampaikan maklumat-maklumat ceramah Sebaliknya propaganda bermatlamatkan memburukkan imej mensabotaj pandai fakta tepat bankrap sebut bincangkan bahaskan TPPA jajahan Amerika rapat sedikit China jualkan China siapa melabur Siapa melabur sekiranya kononnya bankrap tanya GLC labur Kononnya bankrap siapa melabur sahabat mengucapkan setinggi-tinggi tahniah berfakta Seharusnyalah terkeliru cara pembangkang meracuni pemikiran matlamat membenci pertandingan mengampu ketawa Namun lihat disenaraikan tangga ke- inovatif Bloomberg sebenarnya Inovatif fasal kleptokrasi siapa siapa berfakta auta beradab beradab bercakap kacau beradab Bloomberg sebenarnya mengatasi negara-negara maju Bahkan 
DR-07032017,2017-03-07 00:00:00,60, mencabar Segala negara-negara maju penurunan kejayaan seharusnya kejayaan sama-sama hargai mengakui ditadbirkan mengimbas susah meneliti pembangkang mensabotaj kesemua dirancang dilaksanakan ECR Forest City High Speed Rail HSR sabotaj ingat pembangkang sanggup Taiwan menjalankan protes Protes anti-projek kemudian Kuokuang Petrol Chemical Technology diri menyebabkan kerugian RM35 Pembangkang menakut-nakutkan kononnya seramai China diberikan kewarganegaraan menetap Forest City setelah dibina mencetuskan kemarahan China dikeluarkan amaran tertentu fitnah pelaburannya Forest City Inilah katakan sabotaj pembangkang pembangkang mengatakan sekiranya alih memansuhkan mengatakan sekiranya merampas mansuhkan HSR pembangkang cuba sedaya upaya mensabotaj projek- gagal terjejas melabelkan gagal kepimpinan laluan bertanyakan pernahkah iklan diterbitkan pemaju Forest City China iklan langsung menyatakan menyebut tepi Singapura yakin langsung guna kesempatan mengiklankan potensi Singapura penjelasan Serai tanya pembangkang nampak sengaja nampak rosak terang-terang tepi Singapore Cakap ikut surat khabar cakap dengar Shah beritahu 6000 pensyarah diberhentikan Betulkah 6000 6000 pensyarah-pensyarah sambilan berpencen sebagainya buang dirancang pekerjaan pendapat tanya lalu kena jawablah lihat title TV S S Renggam ketawa S Shah Ketawa rasa penjelasan berhubung pemberhentian pensyarah-pensyarah dinyatakan duit teruskan diperlukan rasa sinilah Menteri-menteri Ahli-ahli backbenchers gagal kaitkan segala data statistik kononnya keluar penilaian kajian kononnya transparent adil hakikat kehidupan barang minyak dok mengeluh GST dikenakan bermacam- lalu mean let s stop all this rhetoric Go down to the ground tengok kehidupan dok mengeluh sambil dok mengeluh pemimpin-pemimpin khayalan kononnya semuanya bagus tu People are suffering And it is because of and their policy melakukan tanggungjawab tadbir telus This is the fact it s sabotage punya check and balance teguran dikatakan projek-projek dibatalkan pembangkang Siapa menjamin dijual dijual freehold Forest City tu freehold mengatakan freehold Pandai lawak Shah penipuan Hakikatnya it is freehold So Dulu bermacam-macam kawalan Foreign investment foreign ownership bermacam-macam Jual habis Jual habis Kota Kota sanggah berleter ni berleter cakap benda fakta sebut ditakrif badan-badan bebas cakap persen persen perubahan intra migration pekerjaan lihat contohnya tambah TVET kurangkan sikit perbelanjaan universiti tambah TVET RM4 330000 anak-anak RM4 310000 Tujuannya by million mahir kemahiran meliputi keperluan industri million Maknanya persiapan perubahan struktur semata kebergantungan IPTA 134000 140000 anak- form five masuk universiti beralih kemahiran 300000 tiap-tiap sebabnya perubahan struktur keperluan industri pertambahan melabur negara-negara berlumba-lumba tambah tambah pembesaran pembesaran pekerjaan sudut sempit inilah katakan RM190 petunjuk-petunjuk dinafikan Negara-negara berlumba-lumba Indonesia Myanmar negara-negara even Amerika bawa domesticated Amerika punya polisi bawa Amerika manage upside downside itulah kecekapan menentukan dimanfaatkan lihat sikit Kadang- kadang pengangguran contohnya lihat bank-bank fasa transformasi guna ditinggikan kecekapannya lihat ATM machine menggantikan orang-orang sebabnya rasionalisasi nampaknya peluang-peluang pekerjaan berkurangan tambah tempat-tempat sudut holistik tanya pandangan berlumba-lumba diperlekehkan tambah TPPA lihat sudut sempit inilah pandangan rasa payah layanlah Teruskan usaha-usaha rasa pencapaian Inilah katakan disebut pencapaian divalidate badan-badan bebas stick to the course pandangan Kota Memang tepat bersungguh-sungguh membangunkan pembangkang menafikan fakta GDP memang Disampuk lakukan pendekatan mensabotaj poin Sabotaj pembangkang sering mengatakan menuju arah bankrap kejatuhan kuat waktu USD1 bersamaan RM2 pembangkang bankrap Sebenarnya kejatuhan nilai disebabkan petroleum murah nilai Amerika India nilai Rupee merekodkan kejatuhan parah Peso Mexico kejatuhan terendah Pound Sterling UK kejatuhan terendah Renminbi China kelemahan Pembangkang menyampaikan fakta-fakta memutarbelitkan kejatuhan nilai bankrap Sesungguhnya pendekatan Mantan Berbahagia Tun Mahathir krisis dahulu menjalankan tambatan USD1 RM3 memperkenalkan kawalan capital control melakukannya kawalan capital control impak buruk konteks jangka masuk sejumlah disekat dibenarkan mengeluarkan keseluruhannya menyebabkan kehilangan keyakinan meyakinkan melabur inti pati keyakinan kestabilan menidakkan kawalan sebenarnya landasan mengukuhkan nilai harus membuktikan tetap menjalankan melaksanakan popular sebut kawalan defisit bajet matlamat bajet seimbang mengekalkan sabotaj mana-mana sekiranya mengikuti Point of order yakin nilai Kembali menyerlah selesa dikatakan sabotaj SOSMA economic sabotage dikira jenayah So pembangkang sabotajkan buktikan guna tarik baliklah Siapa makan cili ketawa Siapa rasa pedas ketawa mengucapkan tahniah ulasan Kota makan cili bukti tuduhan tuduhan liar mengucapkan tahniah Kamu cakap kamu bukti ucapkan tahniah keberanian tarik perkataan sabotaj Keberanian proaktif landasan menangani masalah-masalah upah ketidaksamaan Hendak Seterusnya subsidi cekap terlalu bergantung petroleum perjanjian-perjanjian IPP berat sebelah perlindungan ketat menjejaskan kekurangan pengangkutan seimbang mengabaikan negeri-negeri Pantai Timur Sabah Sarawak tersangkut golongan berpendapatan terlalu bergantung xi terlalu bergantung imbangan domestik xii pengaliran keluar haram pengelakan cukai pemantauan mencukupi cukai efisien memerlukan transformasi berani menangani perubahan pasti kritikan ketidakterimaan proaktif menyejahterakan lega krisis dibawakan pembangkang Sebenarnya indikasi-indikasi dijadikan rujukan krisis Antaranya respons lihat menjunam sebaliknya menjawat pengesahan laluan duduk dulu setinggi Padahal serendah pendaftaran kenderaan pendaftaran jatuh setahun penjualan diparas projek-projek terbengkalai terpaksa terbengkalai menampung habiskan duduk dulu kepimpinan terbengkalai disebabkan kononnya krisis nisbah hutang dibayar bermakna nisbah hutang dibayar setinggi nisbah GDP GDP -7 GDP indikasi-indikasi jelas menghadapi krisis parah diuar-uarkan pembangkang pembangkang patut melemahkan keyakinan pelabur-pelabur pengesahan GDP laluan duduk habiskanlah Pelaksanaan GST berani impak positif GST pencukaian SST Saudi Arabia bercadang melaksanakan GST India meluluskan GST propaganda dimainkan pembangkang 70-an barang suka mengaitkannya GST mengekalkan barang terendah selama- lamanya sara hidup tetap taraf hidup Senang pembangkang menuding jari lupa langsung menyumbang sara hidup lihat Pulau Pinang Selangor parking yuran lesen permit dinaikkan Pakatan Nota tarif Pulau Pinang dinaikkan Cukai taksiran Pulau Pinang dinaikkan sewa gerai dinaikkan sampaikan sara hidup sebenarnya berhubung taraf hidup keluarkan mesej WhatsApp perbualan suami isteri Suaminya begini Dulu bil elektrik LLN murah sampai RM20 RM30 sebulan gila-gila Senang-senang sampai RM300 RM400 sebulan memang gila-gila isterinya Tentulah dulu cuma peti sejuk radio kipas meja periuk nasi gaji RM20 sebulan cekik leher periuk nasi peti sejuk besar-besar microwave mesin basuh mesin kering aircon biji ruang tamu TV biji iPad iPhone charger Wi-Fi hub Unifi Astro CCTV kamera merata siap rekoder game PS4 water heater biji komputer biji sampai RM500 sebulan bolehlah bersyukur Kesimpulannya sara hidup tetap disebabkan taraf hidup Perubahan barang terikat tonne value of money inflasi sebagainya sesiapa inginkan dibeli lalu terkeliru sara hidup taraf hidup Taraf kehidupan terikat faktor umum antaranya pekerjaan persekitaran selesa berkualiti dimiliki kualiti penjagaan kualiti infrastruktur pengangkutan senang selesa Akhirnya kena faham disebabkan mutu kualiti taraf hidup bertambah mustahil mengelakkan barang Sekiranya sambung ayat Sekiranya pembangkang mengatakan mengekalkan barang membiarkan harapan janji sekadar memancing undi ianya direalisasikan janji sedap didengar tercapai sambung Ahli-ahli tempohkan 
