"[u'ddec', u'fasal', u'peguam', u'hukum', u'sosma', u'perintah', u'hakim', u'majistret', u'of', u'subseksyen']","[u'ddec', u'hukum', u'mati', u'siasat', u'tuduh', u'peguam', u'perintah', u'hasut', u'jenayah', u'islam']","[u'ddec', u'hukum', u'fasal', u'sosma', u'jenayah', u'subseksyen', u'majistret', u'mati', u'suspek', u'ganas']","[u'ddec', u'mati', u'tuju', u'so', u'libat', u'of', u'the', u'siasat', u'pandu', u'tetap']","[u'ddec', u'mati', u'selangor', u'jaga', u'tuju', u'ingat', u'sabah', u'kaji', u'subsidi', u'khusus']","[u'ddec', u'subsidi', u'gst', u'minyak', u'bajet', u'selangor', u'bayar', u'rasuah', u'sabah', u'kaya']","[u'ddec', u'sasar', u'subsidi', u'laksana', u'bajet', u'kaji', u'khusus', u'memang', u'selangor', u'insentif']","[u'ddec', u'sosma', u'hukum', u'hasut', u'tuduh', u'jenayah', u'peguam', u'suspek', u'ganas', u'dakwa']","[u'ddec', u'insentif', u'tuju', u'bayar', u'pandu', u'so', u'subsidi', u'mati', u'memang', u'bangkit']","[u'ddec', u'subsidi', u'bayar', u'insentif', u'hutang', u'gaji', u'sasar', u'bajet', u'belanja', u'kdnk']","[u'ddec', u'subsidi', u'bajet', u'hutang', u'sasar', u'kdnk', u'kaya', u'minyak', u'belanja', u'selangor']","[u'ddec', u'subsidi', u'bajet', u'selangor', u'minyak', u'sasar', u'kaya', u'rmke', u'sabah', u'borneo']","[u'ddec', u'mati', u'hukum', u'fasal', u'tuju', u'siasat', u'perintah', u'of', u'kertas', u'subseksyen']","[u'ddec', u'mati', u'tuju', u'jaga', u'institusi', u'sasar', u'libat', u'khusus', u'laksana', u'selangor']","[u'ddec', u'mati', u'selangor', u'tuju', u'jelas', u'subsidi', u'libat', u'bayar', u'sampai', u'siasat']","[u'ddec', u'selangor', u'kpkt', u'bayar', u'tuju', u'insentif', u'bangkit', u'lantik', u'gaji', u'bekal']","[u'ddec', u'mati', u'tuju', u'siasat', u'jelas', u'kertas', u'makna', u'so', u'the', u'terang']","[u'ddec', u'subsidi', u'insentif', u'bekal', u'hospital', u'bayar', u'rm1', u'minyak', u'selangor', u'project']","[u'ddec', u'subsidi', u'gst', u'minyak', u'bajet', u'kdnk', u'hutang', u'kaya', u'belanja', u'bayar']","[u'ddec', u'mati', u'tuju', u'subsidi', u'libat', u'kaji', u'selangor', u'jelas', u'hal', u'siasat']"
"[u'ddec', u'fasal', u'peguam', u'undang', u'board', u'of', u'act', u'inquiry', u'law', u'subseksyen']","[u'ddec', u'peguam', u'fasal', u'hasut', u'inquiry', u'tuduh', u'jenayah', u'bebas', u'undang', u'bicara']","[u'ddec', u'fasal', u'undang', u'child', u'173a', u'inquiry', u'subseksyen', u'peguam', u'law', u'act']","[u'ddec', u'bomba', u'pbt', u'timbang', u'of', u'fasal', u'kapal', u'atm', u'the', u'balai']","[u'ddec', u'sungai', u'bomba', u'sampah', u'laut', u'kuala', u'timbang', u'sekitar', u'lumpur', u'bukit']","[u'ddec', u'sampah', u'bumi', u'gst', u'kuala', u'belanja', u'sarawak', u'infrastruktur', u'lumpur', u'timbang']","[u'ddec', u'bomba', u'pbt', u'sampah', u'taraf', u'sekolah', u'rancang', u'kuala', u'sungai', u'timbang']","[u'ddec', u'peguam', u'hasut', u'inquiry', u'tuduh', u'undang', u'fasal', u'jenayah', u'bicara', u'1948']","[u'ddec', u'pbt', u'kapal', u'bomba', u'tourism', u'timbang', u'lumpur', u'sewa', u'skim', u'of']","[u'ddec', u'bayar', u'bomba', u'timbang', u'belanja', u'taraf', u'alit', u'swasta', u'sekolah', u'pbt']","[u'ddec', u'bajet', u'belanja', u'hidup', u'bumi', u'boros', u'krisis', u'gst', u'kapal', u'defisit']","[u'ddec', u'bomba', u'taraf', u'bajet', u'bumi', u'kuala', u'sampah', u'lumpur', u'hospital', u'rancang']","[u'ddec', u'fasal', u'of', u'subseksyen', u'undang', u'peguam', u'inquiry', u'to', u'the', u'any']","[u'ddec', u'infrastruktur', u'lumpur', u'hidup', u'pbt', u'oku', u'kuala', u'inisiatif', u'atm', u'taraf']","[u'ddec', u'bomba', u'laut', u'kapal', u'pbt', u'timbang', u'bumi', u'kota', u'jelas', u'sungai']","[u'ddec', u'bomba', u'pbt', u'kuala', u'lumpur', u'timbang', u'kapal', u'incinerator', u'sampah', u'swasta']","[u'ddec', u'kapal', u'of', u'fasal', u'timbang', u'the', u'memang', u'and', u'jelas', u'board']","[u'ddec', u'bomba', u'pbt', u'hospital', u'kuala', u'taman', u'sampah', u'bukit', u'lumpur', u'sungai']","[u'ddec', u'gst', u'bajet', u'belanja', u'minyak', u'cukai', u'bayar', u'rm39', u'hidup', u'defisit']","[u'ddec', u'pbt', u'bomba', u'timbang', u'atm', u'kapal', u'laut', u'china', u'libat', u'jelas']"
"[u'ddec', u'fasal', u'hasut', u'hakim', u'peguam', u'lembaga', u'tatacara', u'kanun', u'of', u'person']","[u'ddec', u'hasut', u'hakim', u'jenayah', u'bebas', u'hudud', u'fasal', u'peguam', u'1948', u'lembaga']","[u'ddec', u'fasal', u'41a', u'hasut', u'jenayah', u'kanun', u'hakim', u'tatacara', u'person', u'offence']","[u'ddec', u'libat', u'had', u'fasal', u'memang', u'tuju', u'bangkit', u'of', u'the', u'kanun']","[u'ddec', u'sungai', u'sabah', u'sekitar', u'banjir', u'libat', u'memang', u'bersih', u'cemar', u'laksana']","[u'ddec', u'sabah', u'gst', u'sarawak', u'laksana', u'minyak', u'patut', u'pan', u'lantan', u'belia']","[u'ddec', u'laksana', u'belia', u'memang', u'taraf', u'jkr', u'rancang', u'latih', u'sabah', u'sungai']","[u'ddec', u'hasut', u'hakim', u'1948', u'jenayah', u'peguam', u'fasal', u'kanun', u'keseksaan', u'dakwa']","[u'ddec', u'had', u'libat', u'memang', u'kedai', u'francais', u'belia', u'bangkit', u'i', u'insentif']","[u'ddec', u'belia', u'alit', u'laksana', u'had', u'insentif', u'gst', u'swasta', u'sabah', u'tani']","[u'ddec', u'bajet', u'sabah', u'minyak', u'kaya', u'belia', u'gula', u'gst', u'subsidi', u'golong']","[u'ddec', u'sabah', u'tani', u'sarawak', u'pan', u'bajet', u'taraf', u'sekitar', u'belia', u'gst']","[u'ddec', u'fasal', u'tatacara', u'kanun', u'jenayah', u'ordinan', u'libat', u'electronic', u'the', u'means']","[u'ddec', u'sabah', u'libat', u'laksana', u'serama', u'had', u'belia', u'sekitar', u'sarawak', u'memang']","[u'ddec', u'libat', u'had', u'banjir', u'sabah', u'laksana', u'jelas', u'memang', u'bayan', u'siap']","[u'ddec', u'jkr', u'memang', u'siap', u'sabah', u'tapak', u'had', u'latih', u'bangkit', u'sekitar']","[u'ddec', u'libat', u'fasal', u'jelas', u'lembaga', u'memang', u'had', u'bahas', u'dulu', u'bayan']","[u'ddec', u'tani', u'baja', u'insentif', u'sungai', u'sekitar', u'bekal', u'masak', u'selenggara', u'sabah']","[u'ddec', u'gst', u'minyak', u'subsidi', u'gula', u'kaya', u'barang', u'kedai', u'bajet', u'cukai']","[u'ddec', u'libat', u'sabah', u'had', u'memang', u'laksana', u'jelas', u'bangkit', u'serama', u'bahas']"
"[u'ddec', u'keseksaan', u'offence', u'pota', u'hukum', u'ganas', u'penjara', u'criminal', u'sosma', u'jenayah']","[u'ddec', u'keseksaan', u'hukum', u'jenayah', u'ganas', u'penjara', u'hasut', u'pota', u'isa', u'criminal']","[u'ddec', u'keseksaan', u'326a', u'penjara', u'jenayah', u'hukum', u'sebat', u'pota', u'offence', u'criminal']","[u'ddec', u'keseksaan', u'tuju', u'memang', u'penjara', u'kanun', u'laksana', u'bincang', u'kuala', u'jenayah']","[u'ddec', u'banjir', u'kuala', u'pantai', u'lumpur', u'lantan', u'laksana', u'selesai', u'sabah', u'sungai']","[u'ddec', u'lantan', u'belanja', u'laksana', u'sabah', u'banjir', u'sarawak', u'kuala', u'selesai', u'kedah']","[u'ddec', u'laksana', u'banjir', u'jkr', u'kuala', u'rancang', u'lumpur', u'selenggara', u'memang', u'sekolah']","[u'ddec', u'keseksaan', u'jenayah', u'ganas', u'pota', u'hukum', u'isa', u'penjara', u'sosma', u'nal']","[u'ddec', u'kuala', u'lumpur', u'memang', u'dbkl', u'pampas', u'lesen', u'industri', u'tuju', u'skim']","[u'ddec', u'laksana', u'belanja', u'bayar', u'sekolah', u'tani', u'memang', u'tanggung', u'subsidi', u'bajet']","[u'ddec', u'belanja', u'bajet', u'subsidi', u'minyak', u'kaya', u'defisit', u'fiskal', u'sabah', u'lantan']","[u'ddec', u'belanja', u'bajet', u'tani', u'sabah', u'lantan', u'laksana', u'kuala', u'pantai', u'selesa']","[u'ddec', u'keseksaan', u'penjara', u'jenayah', u'hukum', u'kanun', u'offence', u'326a', u'ganas', u'sebat']","[u'ddec', u'laksana', u'lumpur', u'kuala', u'sabah', u'banjir', u'memang', u'pantai', u'tuju', u'belanja']","[u'ddec', u'banjir', u'pantai', u'laksana', u'lantan', u'selesai', u'sabah', u'laut', u'ancang', u'tani']","[u'ddec', u'tender', u'jkr', u'kuala', u'lumpur', u'laksana', u'banjir', u'industri', u'memang', u'siap']","[u'ddec', u'tuju', u'memang', u'penjara', u'jelas', u'tangkap', u'hukum', u'lembaga', u'siapa', u'laksana']","[u'ddec', u'baja', u'kuala', u'selenggara', u'tani', u'lumpur', u'tender', u'jkr', u'laksana', u'bekal']","[u'ddec', u'belanja', u'subsidi', u'gst', u'bajet', u'minyak', u'barang', u'kaya', u'petrol', u'rm1']","[u'ddec', u'laksana', u'agens', u'tuju', u'memang', u'selesai', u'bincang', u'ancang', u'pantai', u'maritim']"
"[u'ddec', u'peguam', u'hakim', u'fasal', u'perintah', u'sosma', u'subseksyen', u'isa', u'of', u'bicara']","[u'ddec', u'hakim', u'tuduh', u'perintah', u'isa', u'peguam', u'jenayah', u'dakwa', u'bebas', u'tahan']","[u'ddec', u'fasal', u'kanak', u'sosma', u'isa', u'jenayah', u'witness', u'subseksyen', u'bicara', u'hakim']","[u'ddec', u'of', u'tuju', u'trade', u'the', u'tentu', u'aes', u'badan', u'laksana', u'perintah']","[u'ddec', u'lantan', u'banjir', u'laksana', u'tebat', u'sarawak', u'kuala', u'tender', u'sekitar', u'lombong']","[u'ddec', u'pakat', u'bajet', u'gst', u'bangkang', u'tiris', u'tender', u'populariti', u'lantan', u'sarawak']","[u'ddec', u'tender', u'laksana', u'bajet', u'sarawak', u'jkr', u'kuala', u'jambat', u'rancang', u'hospital']","[u'ddec', u'isa', u'hakim', u'sosma', u'peguam', u'jenayah', u'tuduh', u'bicara', u'perintah', u'tahan']","[u'ddec', u'tender', u'industri', u'trade', u'jpj', u'tol', u'memang', u'laksana', u'tentu', u'tuju']","[u'ddec', u'bajet', u'tender', u'laksana', u'tabung', u'pakat', u'harus', u'cecah', u'bentang', u'gst']","[u'ddec', u'bajet', u'tiris', u'belanjawan', u'defisit', u'pakat', u'kaya', u'populariti', u'mewah', u'cecah']","[u'ddec', u'bajet', u'tender', u'belanjawan', u'jambat', u'limau', u'tiris', u'pakat', u'gst', u'tani']","[u'ddec', u'fasal', u'of', u'perintah', u'subseksyen', u'kanak', u'jenayah', u'trade', u'sosma', u'the']","[u'ddec', u'laksana', u'perintah', u'tender', u'sarawak', u'bajet', u'kanak', u'ubat', u'sabah', u'tuju']","[u'ddec', u'tender', u'banjir', u'laksana', u'lantan', u'pakat', u'tani', u'tebat', u'cepat', u'bajet']","[u'ddec', u'tender', u'industri', u'siap', u'jkr', u'laksana', u'consultant', u'kuala', u'ecrl', u'tani']","[u'ddec', u'perintah', u'tentu', u'trade', u'tuju', u'of', u'tender', u'makna', u'kuching', u'peguam']","[u'ddec', u'tender', u'hospital', u'tani', u'tol', u'bajet', u'industri', u'sarawak', u'kuala', u'baja']","[u'ddec', u'bajet', u'gst', u'defisit', u'tiris', u'belanjawan', u'cukai', u'kaya', u'cecah', u'belanja']","[u'ddec', u'laksana', u'wujud', u'pakat', u'tentu', u'strategik', u'tuju', u'tn50', u'kaji', u'lantan']"
"[u'ddec', u'pota', u'isa', u'sosma', u'hukum', u'fasal', u'bicara', u'shall', u'law', u'person']","[u'ddec', u'hukum', u'isa', u'pota', u'jenayah', u'tuduh', u'sosma', u'ganas', u'bicara', u'asasi']","[u'ddec', u'pota', u'sosma', u'hukum', u'jenayah', u'keseksaan', u'isa', u'bicara', u'fasal', u'evidence']","[u'ddec', u'insurans', u'hukum', u'kanun', u'person', u'tangkap', u'libat', u'jenayah', u'kaji', u'permata']","[u'ddec', u'sarawak', u'batu', u'bersih', u'memang', u'kaji', u'laksana', u'shah', u'permata', u'tangkap']","[u'ddec', u'bajet', u'bangkang', u'sarawak', u'miskin', u'shah', u'golong', u'kaum', u'laksana', u'gst']","[u'ddec', u'laksana', u'permata', u'bajet', u'kaji', u'sarawak', u'hospital', u'memang', u'infrastruktur', u'selenggara']","[u'ddec', u'isa', u'pota', u'sosma', u'jenayah', u'hukum', u'bicara', u'asasi', u'tuduh', u'keseksaan']","[u'ddec', u'insurans', u'permata', u'memang', u'kendali', u'libat', u'china', u'taska', u'bangkit', u'sukan']","[u'ddec', u'bajet', u'permata', u'hutang', u'laksana', u'golong', u'bayar', u'sasar', u'sejahtera', u'sukan']","[u'ddec', u'bajet', u'defisit', u'belanjawan', u'hutang', u'sejahtera', u'mewah', u'golong', u'kdnk', u'br1']","[u'ddec', u'bajet', u'sarawak', u'hospital', u'belanjawan', u'miskin', u'sejahtera', u'dukacita', u'golong', u'kaum']","[u'ddec', u'hukum', u'jenayah', u'sosma', u'drug', u'keseksaan', u'tangkap', u'fasal', u'kanun', u'person']","[u'ddec', u'permata', u'laksana', u'kanak', u'insurans', u'sejahtera', u'libat', u'bajet', u'infrastruktur', u'sarawak']","[u'ddec', u'permata', u'shah', u'laksana', u'bajet', u'libat', u'kaji', u'jelas', u'kerosakan', u'memang']","[u'ddec', u'kontraktor', u'china', u'laksana', u'bangkit', u'industri', u'kendali', u'sukan', u'permata', u'pbt']","[u'ddec', u'tangkap', u'shah', u'hukum', u'tuduh', u'hak', u'lembaga', u'jelas', u'jenayah', u'bicara']","[u'ddec', u'hospital', u'selenggara', u'taman', u'kontraktor', u'bajet', u'sarawak', u'pbt', u'ibs', u'laksana']","[u'ddec', u'bajet', u'defisit', u'gst', u'hutang', u'kdnk', u'minyak', u'belanjawan', u'subsidi', u'cukai']","[u'ddec', u'permata', u'libat', u'laksana', u'padu', u'kaji', u'tangkap', u'shah', u'sempadan', u'memang']"
"[u'ddec', u'hakim', u'fasal', u'peguam', u'witness', u'subseksyen', u'lembaga', u'artikel', u'isa', u'bicara']","[u'ddec', u'hakim', u'tuduh', u'jenayah', u'ganas', u'anwar', u'peguam', u'penjara', u'bebas', u'bicara']","[u'ddec', u'fasal', u'keseksaan', u'jenayah', u'hakim', u'witness', u'kanak', u'penjara', u'kanun', u'l']","[u'ddec', u'tuju', u'badan', u'libat', u'pandu', u'memang', u'of', u'the', u'tulis', u'agens']","[u'ddec', u'kuala', u'lumpur', u'rancang', u'memang', u'jps', u'kuching', u'selesai', u'asli', u'banjir']","[u'ddec', u'gst', u'bajet', u'minyak', u'miskin', u'cukai', u'bayar', u'kutip', u'1mdb', u'anwar']","[u'ddec', u'rancang', u'latih', u'kuala', u'selenggara', u'laksana', u'memang', u'sekolah', u'lumpur', u'hospital']","[u'ddec', u'hakim', u'jenayah', u'isa', u'ganas', u'peguam', u'keseksaan', u'tuduh', u'sosma', u'bicara']","[u'ddec', u'jpj', u'industri', u'memang', u'bayar', u'pandu', u'kuala', u'latih', u'bincang', u'libat']","[u'ddec', u'bayar', u'cukai', u'bajet', u'gst', u'hutang', u'kutip', u'1mdb', u'golong', u'sekolah']","[u'ddec', u'bajet', u'hutang', u'belanjawan', u'defisit', u'gst', u'miskin', u'gula', u'minyak', u'sejahtera']","[u'ddec', u'bajet', u'rmke', u'gst', u'minyak', u'miskin', u'hospital', u'subsidi', u'rancang', u'gula']","[u'ddec', u'jenayah', u'fasal', u'penjara', u'keseksaan', u'kanun', u'subseksyen', u'to', u'kanak', u'witness']","[u'ddec', u'laksana', u'emas', u'cukai', u'rancang', u'warga', u'bayar', u'libat', u'hidup', u'kuala']","[u'ddec', u'rancang', u'kuching', u'laksana', u'1mdb', u'libat', u'memang', u'tuju', u'bayar', u'jelas']","[u'ddec', u'kuala', u'lumpur', u'china', u'industri', u'selenggara', u'latih', u'tapak', u'memang', u'kontraktor']","[u'ddec', u'tuju', u'cakap', u'bayar', u'lantik', u'jelas', u'bincang', u'kastam', u'lembaga', u'memang']","[u'ddec', u'hospital', u'selenggara', u'kuala', u'lumpur', u'bekal', u'bayar', u'dbkl', u'tampung', u'kontraktor']","[u'ddec', u'gst', u'cukai', u'bajet', u'minyak', u'hutang', u'rm39', u'gula', u'kutip', u'subsidi']","[u'ddec', u'agens', u'libat', u'tuju', u'laksana', u'memang', u'bincang', u'sempadan', u'cakap', u'bangkit']"
"[u'ddec', u'hakim', u'peguam', u'fasal', u'hukum', u'law', u'sosma', u'act', u'judicial', u'keseksaan']","[u'ddec', u'hakim', u'syiah', u'hukum', u'jenayah', u'tuduh', u'bunuh', u'hasut', u'bangkang', u'peguam']","[u'ddec', u'jenayah', u'keseksaan', u'hukum', u'criminal', u'fasal', u'nal', u'kanak', u'code', u'hakim']","[u'ddec', u'of', u'libat', u'code', u'the', u'tugas', u'memang', u'kanak', u'had', u'written']","[u'ddec', u'lantan', u'sabah', u'ajar', u'banjir', u'sarawak', u'selangor', u'batu', u'selesai', u'laksana']","[u'ddec', u'bangkang', u'pru', u'ajar', u'rasuah', u'lantan', u'taat', u'gst', u'kaya', u'arab']","[u'ddec', u'ajar', u'laksana', u'sekolah', u'sukan', u'memang', u'universiti', u'lawat', u'taman', u'swasta']","[u'ddec', u'jenayah', u'hukum', u'hasut', u'hakim', u'nal', u'sosma', u'keseksaan', u'tuduh', u'pota']","[u'ddec', u'sukan', u'memang', u'libat', u'industri', u'swasta', u'taman', u'stesen', u'difahamkan', u'patuh']","[u'ddec', u'ajar', u'universiti', u'sekolah', u'tabung', u'sukan', u'bayar', u'yuran', u'laksana', u'institusi']","[u'ddec', u'belanjawan', u'mewah', u'bajet', u'kaya', u'rasuah', u'bangkang', u'miskin', u'hutang', u'defisit']","[u'ddec', u'bajet', u'belanjawan', u'sedih', u'pru', u'sarawak', u'ajar', u'lantan', u'cina', u'sabah']","[u'ddec', u'jenayah', u'hukum', u'keseksaan', u'fasal', u'kanak', u'dadah', u'any', u'kanun', u'act']","[u'ddec', u'laksana', u'ajar', u'institusi', u'kanak', u'libat', u'universiti', u'jaga', u'sarawak', u'sekolah']","[u'ddec', u'laksana', u'banjir', u'libat', u'sampai', u'lantan', u'ajar', u'memang', u'siap', u'milik']","[u'ddec', u'sukan', u'swasta', u'stesen', u'duta', u'industri', u'difahamkan', u'memang', u'kelulus', u'universiti']","[u'ddec', u'of', u'lantik', u'libat', u'cakap', u'peguam', u'sub', u'the', u'hakim', u'faham']","[u'ddec', u'hospital', u'taman', u'klinik', u'sekolah', u'swasta', u'bekal', u'difahamkan', u'ajar', u'water']","[u'ddec', u'gst', u'kaya', u'belanjawan', u'bajet', u'mewah', u'miskin', u'defisit', u'hutang', u'minyak']","[u'ddec', u'ajar', u'undi', u'libat', u'laksana', u'tugas', u'duta', u'sabah', u'batu', u'calon']"
"[u'ddec', u'fasal', u'sosma', u'subseksyen', u'penjara', u'law', u'shall', u'hakim', u'hukum', u'witness']","[u'ddec', u'penjara', u'hukum', u'jenayah', u'tuduh', u'hakim', u'bicara', u'sosma', u'perintah', u'ganas']","[u'ddec', u'fasal', u'penjara', u'sosma', u'jenayah', u'hukum', u'kanak', u'shall', u'subseksyen', u'undang']","[u'ddec', u'kenderaan', u'aes', u'the', u'libat', u'tarif', u'of', u'pelesenan', u'penjara', u'so']","[u'ddec', u'rolling', u'hospital', u'lantan', u'bekal', u'sabah', u'johor', u'laksana', u'sungai', u'kuala']","[u'ddec', u'13', u'gst', u'bajet', u'pru', u'belanja', u'laksana', u'lantan', u'subsidi', u'gula']","[u'ddec', u'rolling', u'lampu', u'plan', u'hospital', u'taraf', u'laksana', u'taman', u'pakar', u'siap']","[u'ddec', u'sosma', u'jenayah', u'tuduh', u'penjara', u'hukum', u'terrorist', u'bicara', u'pota', u'ganas']","[u'ddec', u'kenderaan', u'tarif', u'aes', u'industri', u'jpj', u'taman', u'murah', u'so', u'libat']","[u'ddec', u'hutang', u'bajet', u'bayar', u'laksana', u'hospital', u'belanja', u'subsidi', u'golong', u'nilai']","[u'ddec', u'bajet', u'hutang', u'gula', u'subsidi', u'defisit', u'mewah', u'kemelut', u'belanjawan', u'belanja']","[u'ddec', u'bajet', u'hospital', u'lampu', u'subsidi', u'jambat', u'gula', u'taraf', u'musim', u'sultanah']","[u'ddec', u'penjara', u'fasal', u'hukum', u'subseksyen', u'jenayah', u'sosma', u'tatacara', u'kanak', u'dadah']","[u'ddec', u'laksana', u'hospital', u'libat', u'taraf', u'pulih', u'kanak', u'pakar', u'nilai', u'bekal']","[u'ddec', u'kenderaan', u'laksana', u'siap', u'lampu', u'elektrik', u'musim', u'pasang', u'bekal', u'milik']","[u'ddec', u'plan', u'bekal', u'rolling', u'kontraktor', u'siap', u'megawatt', u'pakar', u'selenggara', u'taraf']","[u'ddec', u'kastam', u'arak', u'duti', u'the', u'tentu', u'fasal', u'penjara', u'libat', u'makna']","[u'ddec', u'hospital', u'rolling', u'lampu', u'plan', u'bekal', u'taman', u'selenggara', u'pakar', u'murah']","[u'ddec', u'gst', u'bajet', u'subsidi', u'hutang', u'gula', u'defisit', u'belanja', u'cukai', u'kaya']","[u'ddec', u'spr', u'libat', u'agens', u'laksana', u'kenderaan', u'bangkit', u'tulis', u'sabah', u'wujud']"
"[u'ddec', u'fasal', u'act', u'subseksyen', u'hasut', u'peguam', u'sosma', u'syariah', u'tafsir', u'keseksaan']","[u'ddec', u'hasut', u'hukum', u'syariah', u'islam', u'1948', u'hakim', u'keseksaan', u'niat', u'peguam']","[u'ddec', u'keseksaan', u'fasal', u'hukum', u'sosma', u'act', u'subseksyen', u'criminal', u'jenayah', u'undang']","[u'ddec', u'libat', u'sijil', u'badan', u'charge', u'bincang', u'bangkit', u'tuju', u'syariah', u'teknikal']","[u'ddec', u'sekolah', u'sabah', u'lantan', u'banjir', u'rancang', u'guru', u'sarawak', u'perak', u'sampai']","[u'ddec', u'bajet', u'sekolah', u'kaya', u'belanjawan', u'lantan', u'sabah', u'jelata', u'gst', u'tiris']","[u'ddec', u'sekolah', u'rancang', u'guru', u'laksana', u'11', u'taraf', u'rmke', u'sabah', u'pelan']","[u'ddec', u'hasut', u'1948', u'keseksaan', u'sosma', u'hukum', u'pota', u'act', u'ganas', u'jenayah']","[u'ddec', u'halal', u'promosi', u'industri', u'sijil', u'bengkel', u'libat', u'plus', u'stesen', u'spad']","[u'ddec', u'sekolah', u'bajet', u'hutang', u'guru', u'bankrap', u'ajar', u'belanjawan', u'bayar', u'belia']","[u'ddec', u'bajet', u'belanjawan', u'hutang', u'kaya', u'tiris', u'sekolah', u'miskin', u'jurang', u'jelata']","[u'ddec', u'bajet', u'sekolah', u'belanjawan', u'rmke', u'11', u'sabah', u'lantan', u'sarawak', u'jurang']","[u'ddec', u'subseksyen', u'fasal', u'act', u'hukum', u'keseksaan', u'kebankrapan', u'syariah', u'sosma', u'kanun']","[u'ddec', u'sekolah', u'laksana', u'sabah', u'guru', u'halal', u'miskin', u'rancang', u'inisiatif', u'sijil']","[u'ddec', u'rancang', u'lantan', u'banjir', u'sabah', u'laksana', u'siap', u'sampai', u'sekolah', u'libat']","[u'ddec', u'incinerator', u'industri', u'selenggara', u'siap', u'teknikal', u'pbt', u'sekolah', u'bangkit', u'tapak']","[u'ddec', u'charge', u'cakap', u'jelas', u'fasal', u'dulu', u'kemudian', u'halal', u'subseksyen', u'tangkap']","[u'ddec', u'sekolah', u'selenggara', u'hospital', u'taman', u'tapak', u'rancang', u'incinerator', u'plan', u'bekal']","[u'ddec', u'bajet', u'hutang', u'gst', u'belanjawan', u'kaya', u'tax', u'kdnk', u'tiris', u'miskin']","[u'ddec', u'sekolah', u'guru', u'halal', u'sabah', u'libat', u'spr', u'sijil', u'lantan', u'jakim']"
"[u'ddec', u'hakim', u'tafsir', u'fasal', u'peguam', u'majistret', u'perenggan', u'ganas', u'undang', u'law']","[u'ddec', u'hakim', u'ganas', u'hasut', u'tahan', u'isa', u'asasi', u'penjara', u'tafsir', u'jenayah']","[u'ddec', u'majistret', u'hakim', u'fasal', u'organized', u'jenayah', u'ganas', u'tafsir', u'nal', u'penjara']","[u'ddec', u'mkn', u'aes', u'bangkit', u'libat', u'pakai', u'kamera', u'of', u'had', u'senjata']","[u'ddec', u'banjir', u'perak', u'asli', u'sabah', u'mkn', u'laksana', u'timur', u'pahang', u'sampai']","[u'ddec', u'bajet', u'kaya', u'belanja', u'melayu', u'belanjawan', u'defisit', u'miskin', u'laksana', u'gst']","[u'ddec', u'laksana', u'perak', u'lampu', u'banjir', u'rancang', u'asli', u'taman', u'cuma', u'khusus']","[u'ddec', u'hasut', u'hakim', u'isa', u'ganas', u'organized', u'asasi', u'tahan', u'jenayah', u'1948']","[u'ddec', u'fit', u'tourism', u'aes', u'bangkit', u'cuma', u'promosi', u'jpj', u'libat', u'china']","[u'ddec', u'bajet', u'hutang', u'hidup', u'gaji', u'laksana', u'belanja', u'bayar', u'ajar', u'defisit']","[u'ddec', u'bajet', u'defisit', u'kaya', u'hutang', u'belanjawan', u'hidup', u'fiskal', u'miskin', u'belanja']","[u'ddec', u'bajet', u'sabah', u'miskin', u'melayu', u'kaya', u'belanjawan', u'defisit', u'belanja', u'hidup']","[u'ddec', u'penjara', u'fasal', u'jenayah', u'offences', u'mkn', u'subseksyen', u'hukum', u'senjata', u'ganas']","[u'ddec', u'laksana', u'hidup', u'asli', u'inisiatif', u'libat', u'khusus', u'sepenuh', u'jaga', u'agens']","[u'ddec', u'mkn', u'banjir', u'aset', u'radar', u'laksana', u'jpm', u'timur', u'sdn', u'bhd']","[u'ddec', u'sdn', u'bangkit', u'loji', u'bhd', u'lokasi', u'sisa', u'runding', u'agens', u'laksana']","[u'ddec', u'hakim', u'jelas', u'lantik', u'mkn', u'senjata', u'makna', u'siasat', u'tahan', u'tafsir']","[u'ddec', u'asli', u'perak', u'lampu', u'sisa', u'taman', u'water', u'hospital', u'laksana', u'bomba']","[u'ddec', u'defisit', u'bajet', u'kaya', u'hutang', u'gst', u'kdnk', u'miskin', u'inflasi', u'belanjawan']","[u'ddec', u'libat', u'laksana', u'agens', u'bangkit', u'spr', u'sempadan', u'mkn', u'jakim', u'jelas']"
"[u'ddec', u'sosma', u'pota', u'isa', u'fasal', u'bicara', u'cpc', u'subseksyen', u'terrorist', u'hakim']","[u'ddec', u'isa', u'sosma', u'bicara', u'tahan', u'pota', u'terrorist', u'asasi', u'ganas', u'zalim']","[u'ddec', u'sosma', u'pota', u'isa', u'cpc', u'terrorist', u'bicara', u'nal', u'terrorism', u'fasal']","[u'ddec', u'officers', u'so', u'prosedur', u'jelas', u'bangkit', u'the', u'code', u'libat', u'sekira']","[u'ddec', u'banjir', u'bersih', u'laksana', u'benteng', u'sabah', u'sarawak', u'sampai', u'sekira', u'jelas']","[u'ddec', u'gst', u'bajet', u'pru', u'kaya', u'belanja', u'13', u'pakat', u'syukur', u'1mdb']","[u'ddec', u'laksana', u'taman', u'tapak', u'kaji', u'pulau', u'bekal', u'rancang', u'memang', u'sekolah']","[u'ddec', u'sosma', u'isa', u'pota', u'terrorist', u'bicara', u'ganas', u'hasut', u'tahan', u'cpc']","[u'ddec', u'lesen', u'so', u'bangkit', u'promosi', u'memang', u'tulis', u'jelas', u'taman', u'safety']","[u'ddec', u'bayar', u'gaji', u'ptptn', u'golong', u'gst', u'laksana', u'hidup', u'hutang', u'nilai']","[u'ddec', u'kaya', u'bajet', u'gst', u'golong', u'rangkap', u'hutang', u'belanjawan', u'hidup', u'syukur']","[u'ddec', u'bajet', u'gst', u'rmke', u'sarawak', u'syukur', u'laksana', u'belanja', u'sabah', u'hospital']","[u'ddec', u'sosma', u'subseksyen', u'fasal', u'dadah', u'hukum', u'tahan', u'cpc', u'terrorism', u'ganas']","[u'ddec', u'laksana', u'jaga', u'nilai', u'agens', u'libat', u'swasta', u'bayar', u'hidup', u'golong']","[u'ddec', u'jelas', u'banjir', u'laksana', u'sekira', u'1mdb', u'libat', u'milik', u'bencana', u'bangkit']","[u'ddec', u'kbs', u'bangkit', u'bekal', u'tapak', u'kelulus', u'energy', u'pbt', u'plan', u'ancang']","[u'ddec', u'tangkap', u'jelas', u'tahan', u'bicara', u'prosedur', u'faham', u'sosma', u'fasal', u'dadah']","[u'ddec', u'bekal', u'hospital', u'taman', u'tapak', u'ngv', u'gas', u'kelulus', u'cuti', u'sisa']","[u'ddec', u'gst', u'tax', u'kaya', u'bajet', u'cukai', u'hutang', u'belanja', u'belanjawan', u'bayar']","[u'ddec', u'jelas', u'laksana', u'libat', u'bangkit', u'sekira', u'agens', u'kuota', u'kaji', u'tulis']"
