"[u'ddec', u'of', u'islam', u'daftar', u'laksana', u'the', u'spr', u'undi', u'china', u'rasa']","[u'ddec', u'islam', u'undi', u'daftar', u'spr', u'hak', u'agama', u'laksana', u'audit', u'tolak']","[u'ddec', u'daftar', u'undi', u'the', u'of', u'islam', u'china', u'spr', u'rasa', u'and']","[u'ddec', u'daftar', u'laksana', u'spr', u'undi', u'kerusi', u'asean', u'belanja', u'bajet', u'mkn']","[u'ddec', u'undi', u'spr', u'kerusi', u'bajet', u'laksana', u'china', u'belanja', u'paya', u'daftar']","[u'ddec', u'laksana', u'undi', u'bajet', u'china', u'belanja', u'selangor', u'sabah', u'kerusi', u'asean']","[u'ddec', u'laksana', u'bajet', u'china', u'belanja', u'undi', u'kerusi', u'daftar', u'sekolah', u'khusus']","[u'ddec', u'undi', u'spr', u'daftar', u'kaum', u'kerusi', u'islam', u'of', u'hak', u'agama']","[u'ddec', u'laksana', u'audit', u'china', u'sekolah', u'belanja', u'bajet', u'sabah', u'daftar', u'rasa']","[u'ddec', u'belanja', u'bajet', u'laksana', u'daftar', u'spr', u'audit', u'undi', u'rasa', u'sekolah']","[u'ddec', u'bajet', u'belanja', u'laksana', u'china', u'sekolah', u'islam', u'kerusi', u'audit', u'khusus']","[u'ddec', u'bajet', u'laksana', u'belanja', u'china', u'undi', u'sabah', u'khusus', u'ajar', u'selangor']","[u'ddec', u'china', u'daftar', u'laksana', u'undi', u'asean', u'sekolah', u'islam', u'sabah', u'tuju']","[u'ddec', u'daftar', u'laksana', u'undi', u'spr', u'nilai', u'belanja', u'china', u'wanita', u'khusus']","[u'ddec', u'belanja', u'undi', u'bajet', u'laksana', u'daftar', u'spr', u'audit', u'china', u'kerusi']","[u'ddec', u'china', u'daftar', u'laksana', u'undi', u'spr', u'kerusi', u'asean', u'belanja', u'bajet']","[u'ddec', u'laksana', u'spr', u'belanja', u'daftar', u'undi', u'china', u'bajet', u'tuju', u'sabah']","[u'ddec', u'belanja', u'bajet', u'laksana', u'sekolah', u'daftar', u'china', u'sabah', u'khusus', u'rasa']","[u'ddec', u'belanja', u'bajet', u'laksana', u'miskin', u'sabah', u'bayar', u'ajar', u'patut', u'undi']","[u'ddec', u'undi', u'daftar', u'spr', u'laksana', u'sabah', u'china', u'belanja', u'masing', u'kerusi']"
"[u'ddec', u'ajar', u'shah', u'sekolah', u'guru', u'jelas', u'the', u'bajet', u'is', u'diri']","[u'ddec', u'ajar', u'bangsa', u'shah', u'sekolah', u'diri', u'guru', u'tuju', u'jelas', u'bajet']","[u'ddec', u'sekolah', u'ajar', u'guru', u'the', u'shah', u'bangsa', u'is', u'keluarga', u'diri']","[u'ddec', u'guru', u'sekolah', u'laksana', u'libat', u'tuju', u'ajar', u'jelas', u'bajet', u'asean']","[u'ddec', u'shah', u'sekolah', u'bajet', u'indonesia', u'laksana', u'guru', u'ajar', u'bangsa', u'jelas']","[u'ddec', u'bajet', u'shah', u'gst', u'laksana', u'cukai', u'sekolah', u'guru', u'ajar', u'asean']","[u'ddec', u'sekolah', u'bajet', u'guru', u'laksana', u'ajar', u'gst', u'shah', u'bangsa', u'nilai']","[u'ddec', u'bangsa', u'shah', u'guru', u'sekolah', u'ajar', u'tuju', u'diri', u'peguam', u'jelas']","[u'ddec', u'sekolah', u'bajet', u'guru', u'shah', u'ajar', u'laksana', u'gst', u'jelas', u'cukai']","[u'ddec', u'guru', u'sekolah', u'bajet', u'ajar', u'gst', u'cukai', u'laksana', u'bayar', u'bangsa']","[u'ddec', u'bajet', u'sekolah', u'ajar', u'gst', u'guru', u'laksana', u'cukai', u'keluarga', u'shah']","[u'ddec', u'bajet', u'laksana', u'gst', u'sekolah', u'shah', u'ajar', u'guru', u'tani', u'subsidi']","[u'ddec', u'sekolah', u'guru', u'bangsa', u'ajar', u'tuju', u'jelas', u'gst', u'cukai', u'shah']","[u'ddec', u'sekolah', u'guru', u'laksana', u'bajet', u'gst', u'nilai', u'ajar', u'libat', u'keluarga']","[u'ddec', u'bajet', u'shah', u'tuju', u'1mdb', u'libat', u'laksana', u'jelas', u'sekolah', u'ikan']","[u'ddec', u'sekolah', u'bajet', u'laksana', u'ajar', u'asean', u'guru', u'the', u'shah', u'rancang']","[u'ddec', u'shah', u'cukai', u'gst', u'bajet', u'laksana', u'ikan', u'jelas', u'guru', u'libat']","[u'ddec', u'sekolah', u'guru', u'bajet', u'ajar', u'laksana', u'gst', u'bayar', u'cukai', u'memang']","[u'ddec', u'bajet', u'gst', u'cukai', u'sekolah', u'ajar', u'shah', u'subsidi', u'laksana', u'bayar']","[u'ddec', u'sekolah', u'shah', u'guru', u'ajar', u'libat', u'laksana', u'jelas', u'bangsa', u'ikan']"
"[u'ddec', u'the', u'tuju', u'of', u'gaji', u'minimum', u'bayar', u'suruhanjaya', u'and', u'majikan']","[u'ddec', u'suruhanjaya', u'tuju', u'the', u'al', u'adu', u'oic', u'mesir', u'rasa', u'wujud']","[u'ddec', u'the', u'suruhanjaya', u'of', u'tuju', u'adu', u'and', u'rasa', u'minimum', u'gaji']","[u'ddec', u'gas', u'the', u'tuju', u'laksana', u'adu', u'suruhanjaya', u'esscom', u'minimum', u'wujud']","[u'ddec', u'suruhanjaya', u'adu', u'the', u'laksana', u'tuju', u'esscom', u'glc', u'wujud', u'rasa']","[u'ddec', u'laksana', u'bayar', u'gas', u'nilai', u'tuju', u'bajet', u'gaji', u'the', u'glc']","[u'ddec', u'insentif', u'laksana', u'gas', u'tuju', u'miti', u'nilai', u'gaji', u'bayar', u'bajet']","[u'ddec', u'tuju', u'suruhanjaya', u'the', u'rasa', u'batu', u'kaum', u'prinsip', u'adu', u'cakap']","[u'ddec', u'bayar', u'insentif', u'tuju', u'the', u'free', u'suruhanjaya', u'gaji', u'gas', u'minimum']","[u'ddec', u'bayar', u'gas', u'gaji', u'insentif', u'the', u'nilai', u'laksana', u'glc', u'tuju']","[u'ddec', u'gas', u'insentif', u'bayar', u'laksana', u'bajet', u'nilai', u'glc', u'subsidi', u'infrastruktur']","[u'ddec', u'gas', u'laksana', u'bajet', u'subsidi', u'insentif', u'bekal', u'bayar', u'nilai', u'gaji']","[u'ddec', u'tuju', u'gas', u'the', u'minimum', u'suruhanjaya', u'gaji', u'laksana', u'nombor', u'adu']","[u'ddec', u'laksana', u'suruhanjaya', u'the', u'nilai', u'gaji', u'adu', u'minimum', u'tuju', u'insentif']","[u'ddec', u'suruhanjaya', u'tuju', u'glc', u'the', u'gas', u'adu', u'laksana', u'bayar', u'had']","[u'ddec', u'the', u'gas', u'suruhanjaya', u'insentif', u'bayar', u'tuju', u'free', u'gaji', u'nilai']","[u'ddec', u'tuju', u'suruhanjaya', u'gas', u'the', u'bayar', u'insentif', u'laksana', u'gaji', u'sedikit']","[u'ddec', u'insentif', u'gas', u'bayar', u'gaji', u'subsidi', u'laksana', u'infrastruktur', u'nilai', u'free']","[u'ddec', u'gas', u'subsidi', u'insentif', u'bayar', u'glc', u'bekal', u'laksana', u'bajet', u'gaji']","[u'ddec', u'suruhanjaya', u'gas', u'tuju', u'laksana', u'gaji', u'adu', u'insentif', u'minimum', u'esscom']"
"[u'ddec', u'of', u'the', u'minimum', u'jelas', u'to', u'bangkit', u'gaji', u'cakap', u'rasa']","[u'ddec', u'hak', u'bebas', u'bangkit', u'laksana', u'sprm', u'of', u'jelas', u'diri', u'cakap']","[u'ddec', u'of', u'the', u'sprm', u'bangkit', u'to', u'hakim', u'rasa', u'with', u'ibu']","[u'ddec', u'laksana', u'bangkit', u'libat', u'khusus', u'insentif', u'of', u'industri', u'seragam', u'gas']","[u'ddec', u'laksana', u'bangkit', u'rancang', u'kilang', u'libat', u'sprm', u'khusus', u'memang', u'sampai']","[u'ddec', u'laksana', u'kilang', u'bangkit', u'cukai', u'kedai', u'khusus', u'insentif', u'selangor', u'sampai']","[u'ddec', u'laksana', u'insentif', u'industri', u'bangkit', u'kedai', u'kilang', u'memang', u'rancang', u'khusus']","[u'ddec', u'hak', u'bebas', u'sprm', u'cakap', u'bangkit', u'of', u'rasa', u'diri', u'jelas']","[u'ddec', u'insentif', u'bangkit', u'kedai', u'laksana', u'kilang', u'industri', u'libat', u'khusus', u'seragam']","[u'ddec', u'insentif', u'laksana', u'kilang', u'cukai', u'industri', u'bangkit', u'gaji', u'barang', u'subsidi']","[u'ddec', u'laksana', u'insentif', u'subsidi', u'gas', u'industri', u'kedai', u'bangkit', u'khusus', u'kilang']","[u'ddec', u'laksana', u'kedai', u'subsidi', u'industri', u'kilang', u'insentif', u'barang', u'khusus', u'selangor']","[u'ddec', u'laksana', u'kedai', u'barang', u'cukai', u'gas', u'seragam', u'of', u'bangkit', u'tetap']","[u'ddec', u'laksana', u'insentif', u'kedai', u'khusus', u'seragam', u'libat', u'bangkit', u'minimum', u'milik']","[u'ddec', u'bangkit', u'laksana', u'libat', u'rancang', u'jelas', u'milik', u'industri', u'khusus', u'insentif']","[u'ddec', u'laksana', u'kilang', u'bangkit', u'industri', u'insentif', u'rancang', u'gas', u'memang', u'libat']","[u'ddec', u'kilang', u'cukai', u'laksana', u'bangkit', u'insentif', u'jelas', u'barang', u'gas', u'subsidi']","[u'ddec', u'insentif', u'kedai', u'kilang', u'laksana', u'industri', u'subsidi', u'gas', u'bangkit', u'sekolah']","[u'ddec', u'kedai', u'subsidi', u'insentif', u'barang', u'gas', u'cukai', u'laksana', u'industri', u'kilang']","[u'ddec', u'laksana', u'bangkit', u'libat', u'sprm', u'kedai', u'khusus', u'jelas', u'insentif', u'seragam']"
"[u'ddec', u'you', u'lembaga', u'pakai', u'of', u'the', u'jenayah', u'makna', u'tuju', u'hukum']","[u'ddec', u'jenayah', u'lembaga', u'tuju', u'siasat', u'pakai', u'bebas', u'syariah', u'agama', u'makna']","[u'ddec', u'jenayah', u'hukum', u'the', u'kanak', u'seksual', u'you', u'of', u'siasat', u'syariah']","[u'ddec', u'empang', u'tuju', u'pakai', u'memang', u'jenayah', u'sukan', u'laksana', u'belia', u'asean']","[u'ddec', u'empang', u'pahang', u'memang', u'rancang', u'rawat', u'laksana', u'you', u'tumpu', u'tuju']","[u'ddec', u'empang', u'memang', u'laksana', u'sabah', u'tumpu', u'pahang', u'belia', u'makna', u'bentuk']","[u'ddec', u'empang', u'memang', u'laksana', u'rancang', u'tumpu', u'bekal', u'tuju', u'bentuk', u'sukan']","[u'ddec', u'jenayah', u'lembaga', u'fasal', u'tuju', u'hukum', u'siasat', u'bebas', u'tuduh', u'pakai']","[u'ddec', u'empang', u'memang', u'belia', u'tuju', u'pakai', u'you', u'saing', u'the', u'is']","[u'ddec', u'empang', u'saing', u'belia', u'sukan', u'tumpu', u'bekal', u'memang', u'tuju', u'tentu']","[u'ddec', u'empang', u'saing', u'rancang', u'bajet', u'tumpu', u'memang', u'b40', u'pahang', u'bekal']","[u'ddec', u'empang', u'laksana', u'pahang', u'rancang', u'sabah', u'tumpu', u'belia', u'memang', u'bekal']","[u'ddec', u'jenayah', u'tuju', u'pakai', u'empang', u'memang', u'the', u'syariah', u'is', u'you']","[u'ddec', u'empang', u'saing', u'belia', u'laksana', u'g', u'memang', u'syariah', u'jenayah', u'rancang']","[u'ddec', u'empang', u'rancang', u'tuju', u'memang', u'pakai', u'belia', u'sentuh', u'laksana', u'bentuk']","[u'ddec', u'empang', u'memang', u'bekal', u'rancang', u'tentu', u'laksana', u'saing', u'tuju', u'pakai']","[u'ddec', u'tuju', u'empang', u'memang', u'makna', u'jenayah', u'you', u'pakai', u'tentu', u'lembaga']","[u'ddec', u'empang', u'bekal', u'pahang', u'memang', u'infrastruktur', u'laksana', u'rancang', u'sarawak', u'sabah']","[u'ddec', u'empang', u'saing', u'b40', u'bekal', u'kedai', u'gst', u'memang', u'kr1', u'bajet']","[u'ddec', u'empang', u'belia', u'g', u'tuju', u'memang', u'jenayah', u'masing', u'pahang', u'laksana']"
"[u'ddec', u'kanak', u'the', u'peguam', u'of', u'seksual', u'to', u'fasal', u'or', u'hukum']","[u'ddec', u'kanak', u'suruhanjaya', u'seksual', u'bahasa', u'peguam', u'lembaga', u'the', u'islam', u'gubal']","[u'ddec', u'kanak', u'seksual', u'the', u'pornografi', u'hukum', u'child', u'jenayah', u'or', u'sexual']","[u'ddec', u'kanak', u'the', u'libat', u'suruhanjaya', u'seksual', u'of', u'jelas', u'peguam', u'tuju']","[u'ddec', u'kanak', u'libat', u'tengok', u'seksual', u'harus', u'jelas', u'suruhanjaya', u'the', u'kaji']","[u'ddec', u'harus', u'kanak', u'kutip', u'the', u'libat', u'jelas', u'laksana', u'cukai', u'bahasa']","[u'ddec', u'laksana', u'kanak', u'libat', u'koperasi', u'bajet', u'jelas', u'memang', u'tengok', u'bangkit']","[u'ddec', u'kanak', u'seksual', u'peguam', u'jenayah', u'hukum', u'tuduh', u'fasal', u'the', u'gubal']","[u'ddec', u'kanak', u'the', u'koperasi', u'libat', u'suruhanjaya', u'jelas', u'of', u'kaji', u'to']","[u'ddec', u'kanak', u'koperasi', u'the', u'data', u'harus', u'suruhanjaya', u'libat', u'latih', u'tentu']","[u'ddec', u'bajet', u'miskin', u'harus', u'koperasi', u'tengok', u'kaya', u'belanja', u'sarawak', u'oku']","[u'ddec', u'bajet', u'laksana', u'sarawak', u'tengok', u'miskin', u'jauh', u'kaji', u'sekolah', u'sekitar']","[u'ddec', u'kanak', u'the', u'seksual', u'in', u'of', u'suruhanjaya', u'and', u'or', u'libat']","[u'ddec', u'kanak', u'koperasi', u'seksual', u'data', u'suruhanjaya', u'libat', u'the', u'oku', u'laksana']","[u'ddec', u'kanak', u'suruhanjaya', u'seksual', u'jelas', u'libat', u'the', u'harus', u'bahas', u'koperasi']","[u'ddec', u'suruhanjaya', u'the', u'libat', u'koperasi', u'kanak', u'kaji', u'of', u'jelas', u'laksana']","[u'ddec', u'jelas', u'the', u'kanak', u'suruhanjaya', u'libat', u'tuju', u'of', u'lembaga', u'tentu']","[u'ddec', u'sarawak', u'kanak', u'koperasi', u'oku', u'the', u'data', u'kaji', u'laksana', u'memang']","[u'ddec', u'cukai', u'bajet', u'kutip', u'miskin', u'laksana', u'koperasi', u'tengok', u'belanja', u'bayar']","[u'ddec', u'kanak', u'suruhanjaya', u'libat', u'jelas', u'seksual', u'the', u'koperasi', u'agens', u'harus']"
"[u'ddec', u'peguam', u'syariah', u'amal', u'hakim', u'islam', u'legal', u'ubat', u'guam', u'ajar']","[u'ddec', u'peguam', u'amal', u'islam', u'syariah', u'agama', u'hasut', u'sejarah', u'hakim', u'ubat']","[u'ddec', u'peguam', u'syariah', u'kanak', u'hakim', u'hukum', u'islam', u'jenayah', u'sejarah', u'the']","[u'ddec', u'peguam', u'syariah', u'ubat', u'amal', u'tuju', u'sakit', u'islam', u'libat', u'badan']","[u'ddec', u'sejarah', u'amal', u'budaya', u'waris', u'ubat', u'islam', u'tinggal', u'syariah', u'sakit']","[u'ddec', u'amal', u'sejarah', u'ubat', u'derma', u'sakit', u'nilai', u'pulau', u'islam', u'tinggal']","[u'ddec', u'ubat', u'amal', u'ajar', u'sejarah', u'nilai', u'rancang', u'promosi', u'budaya', u'laksana']","[u'ddec', u'peguam', u'hasut', u'hakim', u'amal', u'syariah', u'islam', u'sejarah', u'tafsir', u'dakwa']","[u'ddec', u'ubat', u'peguam', u'promosi', u'syariah', u'waris', u'tuju', u'amal', u'kwsp', u'sakit']","[u'ddec', u'ubat', u'amal', u'nilai', u'alit', u'waris', u'ajar', u'bayar', u'sejarah', u'kwsp']","[u'ddec', u'ubat', u'sejarah', u'waris', u'nilai', u'amal', u'tinggal', u'ajar', u'bayar', u'jauh']","[u'ddec', u'sejarah', u'jauh', u'ubat', u'rancang', u'ajar', u'tinggal', u'pulau', u'laksana', u'budaya']","[u'ddec', u'peguam', u'syariah', u'amal', u'islam', u'ubat', u'tuju', u'kwsp', u'sejarah', u'waris']","[u'ddec', u'ubat', u'amal', u'syariah', u'sakit', u'kwsp', u'waris', u'islam', u'wanita', u'budaya']","[u'ddec', u'amal', u'syariah', u'islam', u'1mdb', u'rasa', u'sejarah', u'peguam', u'kwsp', u'nilai']","[u'ddec', u'ubat', u'nilai', u'bayar', u'pulau', u'1mdb', u'amal', u'rancang', u'ajar', u'doktor']","[u'ddec', u'ubat', u'amal', u'peguam', u'shah', u'syariah', u'tuju', u'bayar', u'sejarah', u'tentu']","[u'ddec', u'ubat', u'sakit', u'bayar', u'promosi', u'nilai', u'rancang', u'alit', u'hospital', u'sewa']","[u'ddec', u'ubat', u'amal', u'gst', u'bayar', u'nilai', u'belanja', u'pulau', u'jauh', u'sejarah']","[u'ddec', u'amal', u'syariah', u'pulau', u'sejarah', u'islam', u'ajar', u'tuju', u'ubat', u'peguam']"
"[u'ddec', u'dakwa', u'jelas', u'anggap', u'tuduh', u'hukum', u'bicara', u'munasabah', u'of', u'tuju']","[u'ddec', u'dakwa', u'tuduh', u'agama', u'anggap', u'hukum', u'siasat', u'hak', u'jelas', u'bebas']","[u'ddec', u'dakwa', u'hukum', u'bicara', u'jenayah', u'penjara', u'tuduh', u'criminal', u'siasat', u'anggap']","[u'ddec', u'laksana', u'tuju', u'jelas', u'bangkit', u'libat', u'memang', u'sabah', u'bincang', u'dakwa']","[u'ddec', u'banjir', u'laksana', u'sabah', u'memang', u'pantai', u'jelas', u'bangkit', u'landas', u'sarawak']","[u'ddec', u'laksana', u'sabah', u'kaya', u'kilang', u'sarawak', u'banjir', u'memang', u'kaji', u'pantai']","[u'ddec', u'laksana', u'memang', u'bangkit', u'sabah', u'rancang', u'tapak', u'sarawak', u'kilang', u'sentuh']","[u'ddec', u'dakwa', u'tuduh', u'hukum', u'jenayah', u'bicara', u'anggap', u'hak', u'tangkap', u'penjara']","[u'ddec', u'laksana', u'bangkit', u'memang', u'jelas', u'spad', u'tuju', u'kaji', u'libat', u'sabah']","[u'ddec', u'laksana', u'alit', u'kilang', u'sabah', u'barang', u'sentuh', u'kaji', u'memang', u'bangkit']","[u'ddec', u'kaya', u'laksana', u'bajet', u'sabah', u'sarawak', u'kilang', u'barang', u'gst', u'alit']","[u'ddec', u'laksana', u'sabah', u'bajet', u'banjir', u'kaya', u'sarawak', u'kilang', u'labuh', u'rancang']","[u'ddec', u'tuju', u'dakwa', u'jelas', u'hukum', u'anggap', u'memang', u'laksana', u'barang', u'rasa']","[u'ddec', u'laksana', u'sabah', u'memang', u'jelas', u'sarawak', u'libat', u'banjir', u'periksa', u'sentuh']","[u'ddec', u'laksana', u'jelas', u'banjir', u'bangkit', u'sentuh', u'sabah', u'libat', u'landas', u'memang']","[u'ddec', u'laksana', u'sabah', u'memang', u'kilang', u'kontraktor', u'sarawak', u'bangkit', u'jelas', u'banjir']","[u'ddec', u'jelas', u'shah', u'tuju', u'munasabah', u'laksana', u'memang', u'dakwa', u'bangkit', u'barang']","[u'ddec', u'laksana', u'kilang', u'sabah', u'memang', u'sarawak', u'kontraktor', u'alit', u'getah', u'banjir']","[u'ddec', u'kaya', u'gst', u'barang', u'laksana', u'bajet', u'cukai', u'sabah', u'sarawak', u'minyak']","[u'ddec', u'laksana', u'jelas', u'bangkit', u'sabah', u'tuju', u'libat', u'sedikit', u'kaji', u'memang']"
"[u'ddec', u'hakim', u'peguam', u'tuduh', u'of', u'is', u'bicara', u'the', u'clause', u'tangkap']","[u'ddec', u'hakim', u'siasat', u'tuduh', u'tangkap', u'tahan', u'peguam', u'jenayah', u'bicara', u'dakwa']","[u'ddec', u'hakim', u'jenayah', u'hukum', u'siasat', u'child', u'bicara', u'tangkap', u'tuduh', u'ganas']","[u'ddec', u'tuju', u'bangkit', u'laut', u'siasat', u'libat', u'convention', u'sabah', u'kapal', u'tentu']","[u'ddec', u'laut', u'sabah', u'jambat', u'jkr', u'bangkit', u'biasa', u'memang', u'pantai', u'tuju']","[u'ddec', u'tol', u'sabah', u'laut', u'jambat', u'pantai', u'belanja', u'laksana', u'jkr', u'bangkit']","[u'ddec', u'jkr', u'laut', u'selenggara', u'tol', u'jambat', u'tapak', u'bangkit', u'memang', u'laksana']","[u'ddec', u'hakim', u'tuduh', u'jenayah', u'tahan', u'bicara', u'peguam', u'dakwa', u'tangkap', u'ganas']","[u'ddec', u'tol', u'tuju', u'laut', u'bangkit', u'pandu', u'kapal', u'kemudian', u'libat', u'memang']","[u'ddec', u'belanja', u'laut', u'tuju', u'bangkit', u'kapal', u'tentu', u'biasa', u'sabah', u'pandu']","[u'ddec', u'belanja', u'sabah', u'laut', u'jambat', u'kapal', u'pantai', u'jauh', u'tol', u'laksana']","[u'ddec', u'jambat', u'tol', u'jkr', u'sabah', u'laut', u'selenggara', u'highway', u'taraf', u'kapal']","[u'ddec', u'tuju', u'siasat', u'dadah', u'hakim', u'clause', u'the', u'convention', u'is', u'in']","[u'ddec', u'laut', u'pandu', u'tuju', u'laksana', u'sabah', u'libat', u'bangkit', u'agens', u'memang']","[u'ddec', u'laut', u'jambat', u'bangkit', u'tuju', u'tol', u'sabah', u'biasa', u'libat', u'kapal']","[u'ddec', u'jkr', u'selenggara', u'kapal', u'bangkit', u'jambat', u'sabah', u'tol', u'laut', u'runtuh']","[u'ddec', u'tol', u'tuju', u'kapal', u'biasa', u'siasat', u'bangkit', u'laut', u'tangkap', u'tentu']","[u'ddec', u'selenggara', u'jkr', u'jambat', u'tol', u'laut', u'sabah', u'kapal', u'belanja', u'angkut']","[u'ddec', u'belanja', u'tol', u'sabah', u'jambat', u'selenggara', u'bayar', u'subsidi', u'laksana', u'angkut']","[u'ddec', u'laut', u'tuju', u'bangkit', u'kapal', u'libat', u'sabah', u'siasat', u'tol', u'agens']"
"[u'ddec', u'fasal', u'law', u'undang', u'of', u'the', u'hakim', u'hasut', u'dakwa', u'lembaga']","[u'ddec', u'hasut', u'zalim', u'dakwa', u'bebas', u'hak', u'hakim', u'tuduh', u'lembaga', u'jenayah']","[u'ddec', u'kanak', u'fasal', u'law', u'undang', u'seksual', u'hukum', u'jenayah', u'hakim', u'perkahwinan']","[u'ddec', u'tuju', u'kanak', u'of', u'hospital', u'laksana', u'muka', u'the', u'memang', u'fasal']","[u'ddec', u'hospital', u'laksana', u'batu', u'memang', u'taraf', u'jerebu', u'tuju', u'jaga', u'bersih']","[u'ddec', u'laksana', u'hospital', u'bajet', u'gaji', u'muda', u'gst', u'memang', u'sarawak', u'golong']","[u'ddec', u'hospital', u'laksana', u'memang', u'taraf', u'jerebu', u'sekolah', u'bajet', u'batu', u'muda']","[u'ddec', u'hasut', u'dakwa', u'undang', u'tuduh', u'fasal', u'kanak', u'jenayah', u'hakim', u'sosma']","[u'ddec', u'tuju', u'memang', u'laksana', u'hospital', u'muda', u'gaji', u'batu', u'tentu', u'hotel']","[u'ddec', u'gaji', u'laksana', u'hospital', u'anggur', u'muda', u'hutang', u'golong', u'belanja', u'tuju']","[u'ddec', u'bajet', u'hospital', u'hutang', u'golong', u'belanja', u'laksana', u'gaji', u'miskin', u'anggur']","[u'ddec', u'hospital', u'bajet', u'taraf', u'laksana', u'aminah', u'gaji', u'muda', u'golong', u'sarawak']","[u'ddec', u'fasal', u'kanak', u'tuju', u'undang', u'of', u'the', u'muka', u'jenayah', u'law']","[u'ddec', u'laksana', u'kanak', u'hospital', u'muda', u'gaji', u'tuju', u'memang', u'golong', u'sakit']","[u'ddec', u'laksana', u'tuju', u'hospital', u'memang', u'libat', u'sentuh', u'batu', u'tentu', u'cakap']","[u'ddec', u'laksana', u'hospital', u'gaji', u'memang', u'tuju', u'taraf', u'hotel', u'tentu', u'swasta']","[u'ddec', u'tuju', u'batu', u'makna', u'memang', u'shah', u'cakap', u'tentu', u'hospital', u'fasal']","[u'ddec', u'hospital', u'taraf', u'laksana', u'bekal', u'memang', u'aminah', u'sakit', u'sekolah', u'bajet']","[u'ddec', u'bajet', u'gst', u'hutang', u'belanja', u'laksana', u'barang', u'hospital', u'minyak', u'subsidi']","[u'ddec', u'batu', u'laksana', u'tuju', u'libat', u'memang', u'daftar', u'jelas', u'tentu', u'muda']"
"[u'ddec', u'peguam', u'subseksyen', u'fasal', u'hakim', u'l', u'of', u'the', u'hasut', u'sub']","[u'ddec', u'hasut', u'bebas', u'peguam', u'hukum', u'jenayah', u'tahan', u'hakim', u'penjara', u'tuduh']","[u'ddec', u'subseksyen', u'fasal', u'keseksaan', u'hukum', u'l', u'jenayah', u'penjara', u'peguam', u'hakim']","[u'ddec', u'subseksyen', u'the', u'tuju', u'of', u'jelas', u'empang', u'bomba', u'peguam', u'memang']","[u'ddec', u'empang', u'sungai', u'asli', u'jelas', u'sekitar', u'memang', u'dahulu', u'ikan', u'harus']","[u'ddec', u'gst', u'empang', u'defisit', u'padi', u'bajet', u'harus', u'belia', u'laksana', u'nilai']","[u'ddec', u'empang', u'gst', u'laksana', u'sukan', u'memang', u'industri', u'belia', u'bekal', u'penuh']","[u'ddec', u'hasut', u'peguam', u'tuduh', u'keseksaan', u'hakim', u'jenayah', u'cabul', u'bebas', u'liwat']","[u'ddec', u'sukan', u'empang', u'industri', u'jelas', u'belia', u'memang', u'ikan', u'tuju', u'padi']","[u'ddec', u'gst', u'nilai', u'1mdb', u'empang', u'belia', u'defisit', u'hutang', u'sukan', u'bekal']","[u'ddec', u'defisit', u'bajet', u'hutang', u'gst', u'b40', u'krisis', u'1mdb', u'hidup', u'belanja']","[u'ddec', u'bajet', u'gst', u'11', u'defisit', u'rmke', u'padi', u'empang', u'tani', u'belia']","[u'ddec', u'subseksyen', u'fasal', u'peguam', u'penjara', u'dadah', u'tuju', u'the', u'jenayah', u'of']","[u'ddec', u'belia', u'gst', u'laksana', u'daftar', u'wanita', u'jelas', u'asli', u'empang', u'memang']","[u'ddec', u'1mdb', u'jelas', u'empang', u'cakap', u'habis', u'tuju', u'memang', u'banjir', u'bekal']","[u'ddec', u'empang', u'industri', u'1mdb', u'sukan', u'memang', u'nilai', u'tani', u'gas', u'belia']","[u'ddec', u'jelas', u'tuju', u'cakap', u'the', u'memang', u'sub', u'of', u'makna', u'shah']","[u'ddec', u'empang', u'bekal', u'padi', u'gas', u'tani', u'elektrik', u'sungai', u'gst', u'industri']","[u'ddec', u'gst', u'defisit', u'bajet', u'hutang', u'cukai', u'rm39', u'belanja', u'gas', u'minyak']","[u'ddec', u'jelas', u'belia', u'daftar', u'kaji', u'ikan', u'tuju', u'empang', u'harus', u'habis']"
"[u'ddec', u'fasal', u'lembaga', u'sosma', u'kanun', u'jenayah', u'penjara', u'peguam', u'tuduh', u'hukum']","[u'ddec', u'jenayah', u'penjara', u'lembaga', u'kanun', u'hukum', u'tuduh', u'sosma', u'fasal', u'peguam']","[u'ddec', u'jenayah', u'fasal', u'penjara', u'kanun', u'keseksaan', u'sosma', u'hukum', u'sabit', u'pesa']","[u'ddec', u'libat', u'lembaga', u'kanun', u'jenayah', u'fasal', u'penjara', u'of', u'tuju', u'the']","[u'ddec', u'lembaga', u'libat', u'kemudian', u'selangor', u'river', u'timbul', u'hutan', u'jaga', u'memang']","[u'ddec', u'kutip', u'bohong', u'selangor', u'laksana', u'kemudian', u'jambat', u'1mdb', u'rasuah', u'sarawak']","[u'ddec', u'laksana', u'libat', u'kutip', u'sekolah', u'memang', u'kuala', u'jambat', u'lumpur', u'taraf']","[u'ddec', u'jenayah', u'sosma', u'tuduh', u'keseksaan', u'kanun', u'penjara', u'hasut', u'fasal', u'hukum']","[u'ddec', u'libat', u'lembaga', u'kemudian', u'kutip', u'tentu', u'tulis', u'fasal', u'memang', u'tuju']","[u'ddec', u'kutip', u'1mdb', u'kemudian', u'bayar', u'laksana', u'cukai', u'lembaga', u'fund', u'belanja']","[u'ddec', u'bajet', u'kutip', u'belanja', u'selangor', u'1mdb', u'hidup', u'berbilion', u'kaya', u'kemudian']","[u'ddec', u'bajet', u'jambat', u'selangor', u'taraf', u'kuala', u'kutip', u'lumpur', u'laksana', u'sarawak']","[u'ddec', u'jenayah', u'fasal', u'penjara', u'lembaga', u'kanun', u'sosma', u'libat', u'hukum', u'dadah']","[u'ddec', u'libat', u'lembaga', u'laksana', u'pulih', u'jenayah', u'kutip', u'agens', u'kemudian', u'penjara']","[u'ddec', u'libat', u'lembaga', u'1mdb', u'kemudian', u'selangor', u'bayan', u'timbul', u'tentu', u'sekira']","[u'ddec', u'libat', u'kemudian', u'miti', u'agens', u'fund', u'laksana', u'memang', u'bayan', u'selangor']","[u'ddec', u'lembaga', u'libat', u'fasal', u'kemudian', u'tentu', u'jenayah', u'makna', u'penjara', u'of']","[u'ddec', u'baja', u'kuala', u'jambat', u'lumpur', u'kutip', u'selenggara', u'tani', u'selangor', u'kemudian']","[u'ddec', u'kutip', u'cukai', u'belanja', u'gst', u'bajet', u'minyak', u'bayar', u'subsidi', u'laksana']","[u'ddec', u'libat', u'lembaga', u'agens', u'jenayah', u'kemudian', u'laksana', u'selangor', u'tentu', u'bayan']"
